id,date,author,text,type,author_channel_url,author_channel_id,edited_date,parent_post_id,parent_username,direct_reply_to,likes
UgwaS5KHdSyAUPYw6aJ4AaABAg,2024-06-01T02:20:27Z,@arsenowijaya4670,"3% x 5 jt x 50 jt  = 7,5 T perbulan.  Lumayan ngelola duit segini..jadi bisa baca dong..untuk siapa?",Thread,http://www.youtube.com/@arsenowijaya4670,UCjn4_baxhzf8IOyL3gaLSUA,2024-06-01T02:20:27Z,,,,0
Ugw9qmbC_RDx3Bh_SoB4AaABAg,2024-06-01T02:07:54Z,@paetrett4487,"Tapera utk pembagunan ikn,, rawan korupsi. Tapera ini dipakai Pengalihan isu kasus besar di indonesia",Thread,http://www.youtube.com/@paetrett4487,UCiBBVLDIBKxtgyLONa7wPKg,2024-06-01T02:07:54Z,,,,0
UgwwobYn9POMQroVPl54AaABAg,2024-06-01T01:55:41Z,@afuklie7474,"Lebih baik pemerintah memperbaiki pertumbuhan ekonomi di atas 7 sampai 8 persen, jgn anteng di 5 saja, kalau ekonomi lebih baik bisa 8 persen rakyat bisa beli sendiri apa yg rakyat inginkan bukan wajib tapi tdk dibutuhkan rakyat,kalau ini hanya akal akalan untuk menipu rakyat batalkan saja",Thread,http://www.youtube.com/@afuklie7474,UCmsSlP6z7ycplb5Ck8E35Wg,2024-06-01T01:55:41Z,,,,0
UgwyNm_j12dX9xgpmxd4AaABAg,2024-06-01T01:51:14Z,@tarjonoaja7666,"Yng ada malah digusur, klo mau bikin rumah baru rakyat suruh cicil",Thread,http://www.youtube.com/@tarjonoaja7666,UClTKUNDufg8z7awACeXi3HQ,2024-06-01T01:51:14Z,,,,0
UgwmRjtXrXLC-2KrCEJ4AaABAg,2024-06-01T01:49:24Z,@Triedanu,Tolak tapera gak jelas uangnya kemana paling buat bancakan  pejabat korup,Thread,http://www.youtube.com/@Triedanu,UCCFoR0jEmrGQIzbgXMU5t-Q,2024-06-01T01:49:24Z,,,,0
Ugy1TrE9HGT7uNX96mh4AaABAg,2024-06-01T01:47:13Z,@tarjonoaja7666,"Jgn2 pemerintah utang sang utang sini ga dpt, rakyat di korbankan, asabri dan Jiwasraya ajh amburadul",Thread,http://www.youtube.com/@tarjonoaja7666,UClTKUNDufg8z7awACeXi3HQ,2024-06-01T01:47:13Z,,,,0
Ugym8HzQGm9uv4FiEP94AaABAg,2024-06-01T01:46:17Z,@LisdonGultom,"Kebijakan itu harusnya menambah gaji buruh, bukan memotong gaji dengan dalih kepemilikan rumah. Spy buruh dapat rumah, permudah syarat kepemilikan rumah, biarkan mereka yg cicil sendiri. Tdk usah bentuk badan untuk mengelola uang buruh. 
Yang namanya tabungan itu tidak bisa dipaksakan. Namanya menabung itu kalau ada sisa penghasilan, apakah buruh sudah mencukupi membiayai hidupnya. ?????",Thread,http://www.youtube.com/@LisdonGultom,UCv2dbuKQAHt_icXqS1Ltjew,2024-06-01T01:46:17Z,,,,0
Ugwf6VHn7UG5KBYZyXN4AaABAg,2024-06-01T01:43:28Z,@antoniussetiabudi3715,Bagi karyawan kecil TAPERA 40 TH JUGA ENGGA BISA pake BELi RUMAH COBA HITUNG saja sendiri .. skrg saja harga  rumah kecil harga SDH 300 juta ...  Kalo dipotong 15o ribu sebulan. jadi selama 1 th setahun 1.8 juta kali 40 TH sama dgn 62 juta bisa beli apa .... Bisa dibayangkan harga rumah 40 th kedepan,Thread,http://www.youtube.com/@antoniussetiabudi3715,UC3XHce5cHl-cmQOAFIxuNbg,2024-06-01T01:43:28Z,,,,0
UgzsHbMum3SJv53jl0t4AaABAg,2024-06-01T01:28:22Z,@tarjonoaja7666,Asabri sama jiwaseraya raib tah kmn skrng tuh,Thread,http://www.youtube.com/@tarjonoaja7666,UClTKUNDufg8z7awACeXi3HQ,2024-06-01T01:28:22Z,,,,0
Ugz3w3bnPdTgTueMgqx4AaABAg,2024-06-01T01:28:17Z,@muchammadholil4942,"Bapertarum itu utk PNS saya 36 th ga ada dapet rumah sampe pensiun, lalu saat pensiun lalu di kasih kan sebesar 1.5 jt. ha ha ha dapet apa ???? tetap ga punya rumah",Thread,http://www.youtube.com/@muchammadholil4942,UCqqQewhxeUyjwkneEIWfRMg,2024-06-01T01:28:17Z,,,,0
Ugxgrz9mYEEh7k4Zi2p4AaABAg,2024-06-01T01:21:24Z,@riancandradewi2636,"Nanti skemanya gimana jika uang udh ke kumpul? Apa di list warga negara yg tdk punya rumah? Terus dr tabungan seindonesia berapa persen yg dpt rumah itu? Terud yg dapat rumah itu apa mreka dapat gratis apa harus cicil lagi?
Jika gratis.... Yg udh punya rumah nuntut dong saya kmaren nyicil kok pasti gitu
Tetus jika misal nyicil, doble dong jadinya nyicil
1 nyicil rumah yg di dapat
2 nyicil tabungan tapera
Terus yg belum dpt bagian rumah itu gimana?
Gak mungkin semua dpt
Ngipi rsanya

Gak sesimpel itu pak pemerintah.....
Apalagi bnyk pejabat yg korupsi

Kalo bpjs selama ini dirasakan manfaat semua org karna disana bnyak bpjs gratis yg d tanggung oleh pemerintah
Dan kami dapatkan langsung manfaatnya, terutama pas sakit atau kecelakaan kerja

Nah ini semua di wajibkan
Gimana yg penghasilan pas2an
Mreka aja ngirit kok
Sekarang disuruh sok2an ikut bantu yg ktnya lebih miskin dari kita
Nah kita aja gak ada yg bantu, malah berharap naik gaji terus

Sy aja nabung uang selalu habis karna ada sja keperluan terutama yg mendadak

Apalagi ini yg ktnya nabung tp gk bisa di tarik",Thread,http://www.youtube.com/@riancandradewi2636,UCojZwmbI-uI8O4eHW76cImA,2024-06-01T01:32:29Z,,,,0
UgzD136hbbHqHXaYU2V4AaABAg,2024-06-01T01:12:58Z,@ketutartawa3711,"Kita jangan mau dikadali, tapera hanya untuk bacakan para koruptor, beda tipis dgn jiwasraya, taspen dll.",Thread,http://www.youtube.com/@ketutartawa3711,UCrdDenYoPl2XH4x7fmfCmFA,2024-06-01T01:12:58Z,,,,0
UgxZmHp_u8qKhcb6A0d4AaABAg,2024-06-01T01:11:00Z,@tarjonoaja7666,"Manfaat untuk siapa, untuk para pejabat mungkin klo untuk rakyat ga bakal, wong harga sembako ajh ga bisa ngendalikn",Thread,http://www.youtube.com/@tarjonoaja7666,UClTKUNDufg8z7awACeXi3HQ,2024-06-01T01:11:00Z,,,,0
UgwhvgluKGAoCsa7rGx4AaABAg,2024-06-01T01:01:57Z,@sugengkaryono469,"TAPERA UNTUK SIAPA...???
UNTUK RAKYAT MENDERITA.
DAN MENYUBURKAN PEJABAT. 🤣🤣🤣",Thread,http://www.youtube.com/@sugengkaryono469,UC81sZR9DP7jThzson9uoDcw,2024-06-01T01:01:57Z,,,,0
Ugw8YzOWr-0biwWe55l4AaABAg,2024-06-01T00:55:05Z,@arozatulozalukhu2670,Susah  dipercaya  pemimpin  yg  pura2  lugu  dan  pura2  baik  kpd  rakyat  saat  ini....yg  pd  achirnya ...  mrk ini  PENGCHIANAT  RAKYAT  mrk  memakai  HUKUM  SEBAGAI  TAMENG  KEKUASAAN  hanya  untuk  kepentingan  keluarga  mrk  dan  croni mrk  dgn  mengorbanksn  rakyat kecil....,Thread,http://www.youtube.com/@arozatulozalukhu2670,UCyvRLynEwmxpFVHkO4lU_OQ,2024-06-01T00:55:05Z,,,,0
UgyQYQOrsOuJ3lu5zAF4AaABAg,2024-06-01T00:50:44Z,@mohamedaugustofficial6636,"udh lah kasian itu rakyat, penjelsan programnya aja muter2 disitu, kenapa kalian g ada ide gb utube aja",Thread,http://www.youtube.com/@mohamedaugustofficial6636,UC-TkB6UYd-kD0wqZg3pyetg,2024-06-01T00:50:44Z,,,,0
Ugy9OXl4n698DtLgeel4AaABAg,2024-06-01T00:40:15Z,@jodifajarrahardi,"Kenapa ga buat program lain, yang buat rakyat jadi sejahtera, penghasilan rakyat jadi naik, malah buat program yg bikin sengsara.
Kalau penghasilan rakyat naik, ga usah pakai tapera pun rakyat bakal beli rumah sendiri.",Thread,http://www.youtube.com/@jodifajarrahardi,UCtVMP9Rui3aSDuKE_Ik1gRA,2024-06-01T00:40:15Z,,,,0
Ugys0o4dWHJP_0Bw85B4AaABAg,2024-06-01T00:36:26Z,@Enthos17adit-zt6fq,Orang bodoh jadi pemimpin jadi kacau negara...tapera ladang korupsi baru,Thread,http://www.youtube.com/@Enthos17adit-zt6fq,UCT12ABcwjGgJdSqZ08-RjWg,2024-06-01T00:36:26Z,,,,0
UgysaPUsal99XlImj2h4AaABAg,2024-06-01T00:35:10Z,@yowisben8551,DPR kok hanya mengeluh...... Tolak dhong ...... DPR kan lembaga legislatif,Thread,http://www.youtube.com/@yowisben8551,UClY4X_GGx1uxYibGG_7p35Q,2024-06-01T00:35:10Z,,,,0
UgzpGQt1_7qrzJP-BXF4AaABAg,2024-06-01T00:30:32Z,@yudiaswanchannel2604,"SATU KATA BUAT KALIAN ,, NIKMATI UANG DAN PILIHAN MU,, OK GAS OK GAS, UANG HABIS SATU HARI MENDERITA LIMA TAHUN ,, SALAM AKAL SEHAT",Thread,http://www.youtube.com/@yudiaswanchannel2604,UCfa02vNk_sAFctDDW0bKulA,2024-06-01T00:30:32Z,,,,0
Ugyi6kF8hJ_1zAcHw7x4AaABAg,2024-06-01T00:15:55Z,@syahruldjamaluddin1229,Mau dicarikan solusi menutupi korupsi kemarin lagu lama sekarang kita tak percaya lagi...,Thread,http://www.youtube.com/@syahruldjamaluddin1229,UC7TjwjyNlgJCo3PGgaO4g1A,2024-06-01T00:15:55Z,,,,0
Ugw9HRkLcz0GxFAtjoJ4AaABAg,2024-06-01T00:10:35Z,@liaamaliah4880,"Alhamdulillah dipaksa untuk berhenti merokok demi punya rumah lagi, lumayan buat anak nanti❤❤❤❤",Thread,http://www.youtube.com/@liaamaliah4880,UCkXUBTlptS2WOpV3PozvWrQ,2024-06-01T00:10:35Z,,,,2
A47GORAATfNA4BD416mvE7,2024-06-02T12:58:33Z,@iyanjak79,"anda merokok? si pemilik usaha perokok? apakah pemilik usaha pilih berhenti merokok atau dgn mudah berhentikan sejumlah karyawannya krn hrs menambah 2,5% demi tapera?",Reply,http://www.youtube.com/@iyanjak79,UCkXUBTlptS2WOpV3PozvWrQ,2024-06-02T12:58:33Z,Ugw9HRkLcz0GxFAtjoJ4AaABAg,@liaamaliah4880,,0
UgzPMZmGOQfmG-vDa6d4AaABAg,2024-06-01T00:06:54Z,@rassyahasbi1265,Bagi mereka 325 kecil karena  sekali korupsi 271 trilyun,Thread,http://www.youtube.com/@rassyahasbi1265,UCEHyk18eNsE7eo_-gvwoLTQ,2024-06-01T00:06:54Z,,,,0
UgwqKPdh1Ho--tniDhJ4AaABAg,2024-06-01T00:04:52Z,@BambangBambangvivo-fr7bf,"Di negeri ini dana/uang apa saja, di institusi, lembaga, pengelola dimana saja yang tidak dikorupsi yang akhirnya dinikmati untuk hajat kemakmuran para koruptor bersama kroni2nta & keluarganya",Thread,http://www.youtube.com/@BambangBambangvivo-fr7bf,UCKdCsd3LiXI3RXzkOZ83TXg,2024-06-01T00:04:52Z,,,,2
Ugw8mniHxshtx2USuMd4AaABAg,2024-06-01T00:04:31Z,@funandlearningnwm,Pemerintah hanya menyakit masyarakat tapi tak pernah kerja dan dana di pakai berpoyah poyah,Thread,http://www.youtube.com/@funandlearningnwm,UCzv0odQl2oIUx8nWPlXnMTQ,2024-06-01T00:04:31Z,,,,0
UgxsjpypeECswGFbvPR4AaABAg,2024-06-01T00:02:40Z,@pramonopramono6267,smoga rezim busuk ini segera tumbang dan diadili seadil adilnya,Thread,http://www.youtube.com/@pramonopramono6267,UCxe1SV_IYoWUTl_sfIrYVMw,2024-06-01T00:02:40Z,,,,0
Ugx5CoYSl6TGVzWFuNx4AaABAg,2024-05-31T23:56:35Z,@funandlearningnwm,Peraturan tak berkeadilan,Thread,http://www.youtube.com/@funandlearningnwm,UCzv0odQl2oIUx8nWPlXnMTQ,2024-05-31T23:56:35Z,,,,0
UgxznY5OOVYQy5vmjWF4AaABAg,2024-05-31T23:51:49Z,@jkwahyu2980,Klo duitnya sudah ngumpul...... antara dikorupsi..... atau dipake dulu untuk pembiayaan yg lain..... mumpung ada duit nganggur nih... dipake aja dulu......,Thread,http://www.youtube.com/@jkwahyu2980,UCcFrW8CNKxg26HQ_W6RHSlA,2024-05-31T23:51:49Z,,,,0
Ugx2tK3VMKPNMLdv8nN4AaABAg,2024-05-31T23:45:55Z,@djokodjuwito4558,"Gaji bukannya dinaikkan malah dibebani tapera
Kebijakan yg ga bijak",Thread,http://www.youtube.com/@djokodjuwito4558,UCuRsGsUcZiDXLHU0-d2Z4Xw,2024-05-31T23:45:55Z,,,,0
Ugxqf_H7hpxkwiKHo6F4AaABAg,2024-05-31T23:40:49Z,@putraganepo8271,Ribuan triliun diksntongnya kapan cair nya,Thread,http://www.youtube.com/@putraganepo8271,UCkQN1qh3ubFtp05Ejm_8Hyg,2024-05-31T23:40:49Z,,,,0
UgzwBM2OEl5xzc50J8p4AaABAg,2024-05-31T23:20:53Z,@eahyaniayu4079,Nanti kalok sudah banyak yang nya terus di koropsi terus rakyat yg sudah namubng TAPERA ini jadi cari uang kemana?,Thread,http://www.youtube.com/@eahyaniayu4079,UC2Ys6qRXQ7zNEckH0VPZpZw,2024-05-31T23:20:53Z,,,,0
UgwirMrlKHLZytvPt-F4AaABAg,2024-05-31T23:07:27Z,@UrayNajilah-fp5ub,Tapera utk para koruptor !,Thread,http://www.youtube.com/@UrayNajilah-fp5ub,UCciXfarVPwkyVxO22KrEJFA,2024-05-31T23:07:27Z,,,,0
UgxicQg8vb12XTzc_yd4AaABAg,2024-05-31T23:05:42Z,@muhammadiwan4392,"1. DG ADANYA KASUS-2 KORUPSI UANG TABUNGAN RAKYAT YG DIKELOLA PEMERINTAH LAH MEMBUAT RAKYAT SDH TIDAK PERCAYA LAGI.
2. SDH ADA TABUNGAN SERUPA SBLMNYA
3. UANG GAJI SAAT INI SDH MEPET BANGET UTK KEHIDUPAN SE-HARI2.
4. IDE TAPERA INI RAKYAT MENILAI HANYALAH HASIL TIPA-TIPU PENGUASA PENDUSTA   NGUMPULIN UANG RAKYAT UTK DPT DIMANFAATKAN OLEH PENGUASA.
5. KESIMPULANNYA : ""TOLAK KERAS IDE BODOH TAPERA""",Thread,http://www.youtube.com/@muhammadiwan4392,UCwArnic4bPJctQkvuPzEw5w,2024-05-31T23:05:42Z,,,,0
Ugy84UheAyB-TH-qUFl4AaABAg,2024-05-31T23:01:56Z,@imaderaisuparta8729,"Ayo gas...ayo gas....gaji dipotong makan siang gratis, gotong royong  untuk membuat lapangan kerja buat koruptor.",Thread,http://www.youtube.com/@imaderaisuparta8729,UCNhikmacF1aiDB3Y-6sWBOA,2024-05-31T23:01:56Z,,,,1
Ugx3mVdGDhrzz3Kh0ol4AaABAg,2024-05-31T22:57:13Z,@MarzukiJuki-dr6qi,Manta pa Bambang susatio. Tolak Tapera .,Thread,http://www.youtube.com/@MarzukiJuki-dr6qi,UCaKPhgX9IXPd62XRQAVmesg,2024-05-31T22:57:13Z,,,,0
UgzKN7YKf8C0sGKc4eB4AaABAg,2024-05-31T22:56:24Z,@eahyaniayu4079,BPJS aja sudah betarpa thn rakyat membayar nya malah sekarang BPJS  mau di cabut ada anak kita yg baru di angkat PNS  gaji nya aja masih sedikit kok malah di wajib kan bayar iyuran TAMPERA segala rakyat sudah pesudah susah harga sembako aja sudah semua mahel tega sekali sama takyat ny,Thread,http://www.youtube.com/@eahyaniayu4079,UC2Ys6qRXQ7zNEckH0VPZpZw,2024-05-31T22:56:24Z,,,,0
UgyVoXJ2ReeuCrplkQ94AaABAg,2024-05-31T22:50:34Z,@eahyaniayu4079,Kami buruh migran yg pergi mencari sesuap  nasi untuk menapkahi anak keluarga kami aja kadang 2 tidak memcukupi  malah rakyat di suruh membayar TAMPERA segal,Thread,http://www.youtube.com/@eahyaniayu4079,UC2Ys6qRXQ7zNEckH0VPZpZw,2024-05-31T22:50:34Z,,,,1
UgzHJm8yG2algaGoB-x4AaABAg,2024-05-31T22:18:54Z,@dahlanasda354,"Anggota DPR/DPRD tidak memihak kepada rakyat. rumahnya ga bagus asal-asalan semua yang dapat rumah pasti di rubah atau diganti, ini pemborosan kenapa ga diberikan dananya agar di kerjakan sendiri",Thread,http://www.youtube.com/@dahlanasda354,UCKobOt0jsTpVcLWzpn54Wcg,2024-05-31T22:18:54Z,,,,0
UgxenLkQegI3NRRYZTB4AaABAg,2024-05-31T21:48:00Z,@sitinuraini2442,"Buruh kalo ga di PHK mending,kalo yg di PHK bagaimana kelanjutannya, pokoknya jgn mau lh,hrs menolak",Thread,http://www.youtube.com/@sitinuraini2442,UCGxLdJVF4axPw-Me4D6SYYw,2024-05-31T21:48:00Z,,,,0
UgzbwUn7A1dAQgWMalp4AaABAg,2024-05-31T21:34:29Z,@waginosulastri5598,Makanya rezim jgn jadi maling2 uang negara.  Dasar rezim mafia bikin UU seenak udelnya sendri. Ujung2nya pasti dikoropsi,Thread,http://www.youtube.com/@waginosulastri5598,UCUs4fbXTWX0YVFoWO2u8mFw,2024-05-31T21:34:29Z,,,,0
UgyP1coatd6PHorwNf14AaABAg,2024-05-31T21:28:10Z,@anaselvia7000,"Negara ini benar"" dikelola orang"" yg rakus n selluendholimi rakyat setiap ke ikakan tp disogok dg blt n sembako tp itupun dikorupsi oleh pihak"" yrtentu",Thread,http://www.youtube.com/@anaselvia7000,UCEaktXOxBebZ01xuEJTvLFA,2024-05-31T21:28:10Z,,,,0
UgyYDrY8c5NxdKW5VWh4AaABAg,2024-05-31T20:49:23Z,@wawangago4278,Untuk calon koruptor cucunya iblis😅,Thread,http://www.youtube.com/@wawangago4278,UCimHjAxf_ZPwMlPXgeY7jqA,2024-05-31T20:49:23Z,,,,0
Ugwy-ASFxXqyd0swDbN4AaABAg,2024-05-31T19:58:20Z,@fitriamardiyano6286,PERSIDEN  pengecuuut. Cuma bebani rakyat Indonesia.,Thread,http://www.youtube.com/@fitriamardiyano6286,UC0EBeT6UWftKeZqUhPmDjsw,2024-05-31T19:58:20Z,,,,0
Ugx0xSvr41VVHnKcIG54AaABAg,2024-05-31T19:53:20Z,@eri07chanel,Tapera untuk 02...biar bisa ngongkosin makan siang gratis....😂😂😂😂😂😂😂😂😂😂😂😂😂😂,Thread,http://www.youtube.com/@eri07chanel,UCdy9xD0S7QGhfBxB2X-RK2A,2024-05-31T19:53:20Z,,,,0
UgzOw64aWpwOV1hzxUB4AaABAg,2024-05-31T19:35:31Z,@sudrajatu9840,Ngeri kalau Revolusi rakyat terjadi dan menggelegar seperti reformasi aing mah tobatt ulah ka anak cucu .ngalami lagi.toubatt.hirup susah ..cari acis.susah,Thread,http://www.youtube.com/@sudrajatu9840,UCds7XSiHGLlfPQtXe4PH8-g,2024-05-31T19:35:31Z,,,,0
Ugz7AiTuhUcLC8DtmpB4AaABAg,2024-05-31T19:35:05Z,@jokopriyono3348,"saya kira saya aja yang tidak bisa matematika,, ternyata ada yang lebih parah dalam berhitung..",Thread,http://www.youtube.com/@jokopriyono3348,UCVcZ6ZYxwRt7UBsxt-USpew,2024-05-31T19:35:05Z,,,,0
Ugy1e-h9fVrcBHoV1JR4AaABAg,2024-05-31T19:29:33Z,@sudrajatu9840,"Tapera....tabungan perumahan rakyat ..

Rakyat yg mana ?.jaman psk alm pak Harto perumnas..jaman kini.kelsrkan dsja mobil.es.em.ka kadohan yg sudah inden terlslu lama nunggu pak",Thread,http://www.youtube.com/@sudrajatu9840,UCds7XSiHGLlfPQtXe4PH8-g,2024-05-31T19:29:33Z,,,,0
UgwdZfGPbrsX7Yer1A54AaABAg,2024-05-31T19:20:59Z,@harizalnordin1617,Uang nya untuk bikin modal makan pagi bergizi...,Thread,http://www.youtube.com/@harizalnordin1617,UCAwKgzVlXOkSsJ_ktr6PPdA,2024-05-31T19:20:59Z,,,,0
UgxaeqsoSJ96l5CN6lB4AaABAg,2024-05-31T19:19:43Z,@arisafandi7697,"Lahan korupsi baru, asabri jiwasraya kemana",Thread,http://www.youtube.com/@arisafandi7697,UCGsi7H_AODR6Qz1wECzJjpg,2024-05-31T19:19:43Z,,,,0
UgyBzK5lCj0pt3UJFml4AaABAg,2024-05-31T19:14:49Z,@AEW1622,"Sesudah UU Cipta Kerja, sekarang TAPERA. Lengkap sudah penderitaan kami para pekerja.",Thread,http://www.youtube.com/@AEW1622,UCKRRjWLtI3uaMpVt_5q0j4Q,2024-05-31T19:14:49Z,,,,55
Ugzojh4YPISgZcVERU94AaABAg,2024-05-31T19:11:47Z,@sarwadinyoman5695,Si plonga plongo memang bukan sekedar julukan tapi autentik...,Thread,http://www.youtube.com/@sarwadinyoman5695,UC9vbgUBEC9JZ0c_f9fnYuSA,2024-05-31T19:11:47Z,,,,0
UgwHDFsX4h4vX0py87J4AaABAg,2024-05-31T18:50:20Z,@BimaIndarto-rx6ke,Woy Pak!!! Saya mau tanya? Emang Apa saja yang jelas yg diberikan Negara kepada rakyatnya? Tolong dijawab yang baik😅,Thread,http://www.youtube.com/@BimaIndarto-rx6ke,UCBHCB_p7ccYPiu9e7AN9w5A,2024-05-31T18:50:20Z,,,,0
UgzJVQb9VJRfm9pb2e54AaABAg,2024-05-31T18:49:24Z,@MediaBogor,hahahahaha inilah beban lagi bagi buruhhhhh situasi ekonomi sedang kurang baik begini,Thread,http://www.youtube.com/@MediaBogor,UCV-ZugmncB3Ggemz4j59_zQ,2024-05-31T18:49:24Z,,,,0
UgybkVEWKbRReHqGcpN4AaABAg,2024-05-31T18:49:06Z,@yoyonroom2790,Tabungan kok dipaksa...? Cm di konoha ini pak yg dipaksa.. makin ketahuan belangnya pakde satu ini. Eling pak.. dulu panjenengan jg rakyat kecil.,Thread,http://www.youtube.com/@yoyonroom2790,UCqnDltv_sU7buA4X5g0Da6Q,2024-05-31T18:49:06Z,,,,0
UgyMbMF6i53QZXxCLMt4AaABAg,2024-05-31T18:48:22Z,@MatJan-qw2rb,Hidup aja susah 😅 ada ada aja,Thread,http://www.youtube.com/@MatJan-qw2rb,UCZjApouBGmCr_2XjKc8mvgA,2024-05-31T18:48:22Z,,,,0
Ugw9_BUFfhFJyGQUAjp4AaABAg,2024-05-31T18:29:50Z,@M0ZK,"Tapera....untuk koruptor, ujung2nya klo dah ngumpul banyak terus dikurupsi !!!",Thread,http://www.youtube.com/@M0ZK,UCNw224qCinT64rG-vIca8Kw,2024-05-31T18:29:50Z,,,,0
UgxdUstE4Aw1FqElwY54AaABAg,2024-05-31T18:28:32Z,@iduyrosadhi4270,I dont care,Thread,http://www.youtube.com/@iduyrosadhi4270,UCrmtG-ZvmmzSlx8l_lXuUCg,2024-05-31T18:28:32Z,,,,0
UgxrB2Q9ojoWJ_w3vyB4AaABAg,2024-05-31T18:18:04Z,@tadpole5481,Lahan korupsi lagi yg di rencanakan,Thread,http://www.youtube.com/@tadpole5481,UC5xXOmtw72jqu3ud-um0bFg,2024-05-31T18:18:04Z,,,,0
Ugxjg1SbAZYEubK0aEN4AaABAg,2024-05-31T18:18:01Z,@wandydiwan1094,"TAPERA tabungan ngk jelas,ujung2ny ke depan jadi kisruh duit ny ngk jelas kemana .kasus asabri dn lainy sdh ada contoh,ingat negri ini sarangny korupsi jd yakin lh depan TAPERA ini akan ngk jelas jg,lagi2 rkyt kecil di peras duitny utk subsidi negara,bkn negara yg subsidi rkytny. Ini cuma akal2 lan aja yg tujuanya cm ngumpulin duit rkyt yg di paksa kn hanya utk membyr hutang negara yg sdh kolep jrn habis bt bangun IKN atau ujung2 ny ya di korupsi,ingat korupsi adanya budaya para elit2 negri ini.",Thread,http://www.youtube.com/@wandydiwan1094,UC1PdyRDyjnbgwZVpo2KlC1Q,2024-05-31T18:18:01Z,,,,0
UgxcRC3YenOBgaKqopx4AaABAg,2024-05-31T17:58:21Z,@irfanm7440,Untuk biaya makan gratis sama buat biaya kampanye kaesang,Thread,http://www.youtube.com/@irfanm7440,UC2MNcrWDXxml-2UdnPrvjdQ,2024-05-31T17:58:21Z,,,,0
Ugwd1yiFwKQGj5GcoBh4AaABAg,2024-05-31T17:53:21Z,@zeanadaaddorable40,"Moderator kurang tajam dan memiliki pengetahuan yang dangkal dengan topik yang di bahas... Diskusi jadi tidak ngambang. Kalo tapera bisa memberikan kepastian kepemilikan rumah seperti hal nya keberangkatan haji, saya yakin masyarakat antusias.",Thread,http://www.youtube.com/@zeanadaaddorable40,UCpOjPZ8cDd2TS3foz5J6HfQ,2024-05-31T17:53:21Z,,,,1
Ugw8XQPwHMum_00AR-B4AaABAg,2024-05-31T17:47:15Z,@user-xi6bi6ce8p,INI YG RAMALAN GUMAY..BAKAL ADA DEMO BESAR BESARAN..,Thread,http://www.youtube.com/@user-xi6bi6ce8p,UC_SSW-A1vc3DXFs4y4W_LVg,2024-05-31T17:47:15Z,,,,0
UgyUUP-b5ueFEksccvF4AaABAg,2024-05-31T17:46:01Z,@djahrafataruba4292,ASN yang pensiun yang uda punya rumah hanya dapat 7 juta dari 32 tahun pengabdian 😢,Thread,http://www.youtube.com/@djahrafataruba4292,UCmc0datq_xt4351RFVhWQxQ,2024-05-31T17:46:01Z,,,,0
UgzaEcYt2_-Nxm3c7_14AaABAg,2024-05-31T17:40:50Z,@winnysyarief,"Ini mah akal2an jkw & gerombolannya aja. Palingan jg buat ikn + makan gratis + bagi2 ama kroni. Secara kan ngutang dah susah, investor jg ga ada yg mau, omongan Baginda udah ga laku ga ada yg percaya lg.",Thread,http://www.youtube.com/@winnysyarief,UC2iLNq-2ISWjATZVaTZy4mw,2024-05-31T17:41:28Z,,,,0
UgxVT924D6LV94Zsprh4AaABAg,2024-05-31T17:40:41Z,@MuhamadAlpayet,rejim perampok uang rakyat susah,Thread,http://www.youtube.com/@MuhamadAlpayet,UCKMeWxsrDNRkDIkv26COsBQ,2024-05-31T17:40:41Z,,,,0
Ugwy2KBQxKSyhmY3wop4AaABAg,2024-05-31T17:36:22Z,@boy-eh5lc,"Mungkin buat gajih dpr lebih tepatnya,mereka kan selalu di manjakan sama si joko",Thread,http://www.youtube.com/@boy-eh5lc,UCXa8zpnQ3iolfkc1tOL2IPQ,2024-05-31T17:39:11Z,,,,0
Ugx6AjtmYFJUpMGupX54AaABAg,2024-05-31T17:11:48Z,@bambangwaris377,tapera buat bayar buser2    02 dan beli bubur kacang hijau dan telur penganti  susu ...negara pling lucu ya Indonesia  ini ....bukan y pejabat2 yg kurangin gsjiy kok mlh buruh yg gajiy kecil ...yg aj di korupsi  apa lagi ini kacao,Thread,http://www.youtube.com/@bambangwaris377,UCi5fKddSoikPhfxnyzPwsdQ,2024-05-31T17:11:48Z,,,,0
Ugxyotdob9RN4sxmOQJ4AaABAg,2024-05-31T17:03:28Z,@rickyandrianugraha,TAPERA=TAMBAH PENDERITAAN RAKYAT,Thread,http://www.youtube.com/@rickyandrianugraha,UCJm_3PiEekLGXroXnZObrCQ,2024-05-31T17:03:28Z,,,,1
Ugx-lSwSUNiWEEqab4F4AaABAg,2024-05-31T17:00:00Z,@khoirulhadi1327,Lambe mu Jok... Djiancoookk!!,Thread,http://www.youtube.com/@khoirulhadi1327,UC703xzUnfwRt2OBD6l26hFQ,2024-05-31T17:00:00Z,,,,0
Ugy7aeeE6g88rNaurBd4AaABAg,2024-05-31T16:51:41Z,@heriheryadi8235,Ini mah kayanya politik dananya  di putar buat makan siang geratis.,Thread,http://www.youtube.com/@heriheryadi8235,UCCVlSTCUTwKQXaP2HlHbCvg,2024-05-31T16:51:41Z,,,,0
A46U9nTYCjFA46UCiNGA_4,2024-05-31T16:52:05Z,@heriheryadi8235,Akal bulus iniah,Reply,http://www.youtube.com/@heriheryadi8235,UCCVlSTCUTwKQXaP2HlHbCvg,2024-05-31T16:52:05Z,Ugy7aeeE6g88rNaurBd4AaABAg,@heriheryadi8235,,0
UgwPPLRTW3AxunIrzqd4AaABAg,2024-05-31T16:45:35Z,@gizidietsnt3888,"Indonesia punya potensi luar biasa tiada banding didunia ini, asalkan pemimpinnya baik eksekutif yudikatif dan  legislatifnya jujur amanah bertanggungjawab melaksanakan amanat  UUD 45 dengan konsekwen, melindungi segenap tumpah darah lndonesia dan memanfaatkan SDA yang melimpah untuk kemakmuran rakyat. Menegakkan supremasi hukum, hukum tajam kearas dan kebawah, hukum mati koruptor, no KKN, pajak tinggi bagi orang kaya, blokir dan sita uang judi online yang beromset triliunan per harinya,  dan rakyat akan sejahtera terjamin kehidupan sosial ekonomi  pendidikan kesehatan budaya politik keamanan ""tentrem kerto raharjo kalis ing sambikolo""",Thread,http://www.youtube.com/@gizidietsnt3888,UCwJ4GHfi7f1KLwiwiUDgQnw,2024-05-31T16:45:35Z,,,,2
Ugzv2Fvxt2rHYAYiKAd4AaABAg,2024-05-31T16:45:22Z,@kimberlvy,rakyat selalu di bikin susah hadeuuuh ...bikin kebijakan yg hjg. Selalu memberatkan rajyat kecil toh  pak de,Thread,http://www.youtube.com/@kimberlvy,UCL8TqCqMDNIXBLmyKhpUyJA,2024-05-31T16:45:22Z,,,,0
Ugxmq3EGMXbZ5IWZzBV4AaABAg,2024-05-31T16:40:25Z,@dasepmaskin9195,alam daratan lautan .di kelola .yg gak bner.apa yg terjadi..katany kaya..😮😮😮,Thread,http://www.youtube.com/@dasepmaskin9195,UCgqKIZSXlYEwLWOIjHzezvg,2024-05-31T16:40:25Z,,,,0
Ugz3IMQBgYUOHZuaLLt4AaABAg,2024-05-31T16:38:21Z,@haryono1962,Dana ini dipersiapkanbuntuk makan siang gratis karena pemerontaj gak ada dana makan siangbgrayis,Thread,http://www.youtube.com/@haryono1962,UCkW7WODICP5uKSdnBxXOgNg,2024-05-31T16:38:21Z,,,,0
Ugy9apoa10jmXlvjmFB4AaABAg,2024-05-31T16:34:52Z,@haryono1962,TAPERA UNTUK CALON KORUPTOR SEBAB DANANYA SETEKAHVTERKUMPUL GSK JELAS  SEPERTO DSNA ASSBRI  FIKORUPSI,Thread,http://www.youtube.com/@haryono1962,UCkW7WODICP5uKSdnBxXOgNg,2024-05-31T16:34:52Z,,,,0
Ugy7YwpjW-S8oidUdmx4AaABAg,2024-05-31T16:33:56Z,@jarumsri2700,"Se7 dengan pendapat para nara sumber ""Tapera"" Tambahan Penderitaan Rakyat dibatalkan saja salam sehat 🇮🇩🇮🇩🤝",Thread,http://www.youtube.com/@jarumsri2700,UCN09V_23A_zREdk8ZEqODgA,2024-05-31T16:33:56Z,,,,1
UgzKhFBoI7RtybXLneZ4AaABAg,2024-05-31T16:32:21Z,@aldanchannel3182,"Hukum mati Koruptor, sita harta kekayaannya kemudian uang nya pakai untuk kebutuhan rakyat miskin. yg setuju like.....",Thread,http://www.youtube.com/@aldanchannel3182,UCD2VyduQn-VOBMzUJvlJcow,2024-05-31T16:32:21Z,,,,189
UgxzFWzNx3wi5Q7ni_Z4AaABAg,2024-05-31T16:30:55Z,@sangpetualangchannelbaru6898,Program joko yg memang selalu memaksakan dan menguras keringat rakyat,Thread,http://www.youtube.com/@sangpetualangchannelbaru6898,UC0oLZgIvU4mVRPYgt8YoWmA,2024-05-31T16:30:55Z,,,,0
UgzQ8x8KMaM5ALKDCB94AaABAg,2024-05-31T16:25:22Z,@pernandolumbantoruan9721,gaji buruh itu sdh di hitung se nimin munkin.jadi gaji buruh ga banyak lebuh tiap bln.klo ada kredit motor ana sekolah gaji buruh pasti tekor sdh,Thread,http://www.youtube.com/@pernandolumbantoruan9721,UCqSiFWPJM2YkOL0vslUV5ng,2024-05-31T16:25:22Z,,,,0
UgzdDwqhGRYEWyeXdN14AaABAg,2024-05-31T16:23:44Z,@kumbang0707,"Wahh makin AMBURADUL...
Mau lengser sj bikin ulah terus...
MIRIS BENER.....",Thread,http://www.youtube.com/@kumbang0707,UCbCzhJ8zlZNbP86IREl4wVQ,2024-05-31T16:23:44Z,,,,0
UgwMF357UWkPNGqG6lV4AaABAg,2024-05-31T16:15:36Z,@musatakimkim9120,TAPERA sajaa yg di bahas tdk usah lag menyekolahkan dan menguliahkan anak,Thread,http://www.youtube.com/@musatakimkim9120,UCvjWieoXBbYEXbG0tXg-97w,2024-05-31T16:15:36Z,,,,0
UgwdSG2DPajucVcso-t4AaABAg,2024-05-31T16:15:06Z,@user-ut4dg6mx9s,"DPR atau MPR RI, jangan pikiran nya cuma mau peras rakyat membuat undang undang tidak memihak rakyat. 
Itu loh yang kalian harus secepat nya mengesah kan undang undang perampasan aset dan hukuman  mati bagi koruptor.",Thread,http://www.youtube.com/@user-ut4dg6mx9s,UCV2v-0X2iTO1E90cmhdnnhg,2024-05-31T16:15:06Z,,,,0
Ugwt8VF0tIuQOv_Sgs14AaABAg,2024-05-31T16:08:42Z,@sriwahyuni-xp9fr,"Mendingan nabung sendiri pake emas. Nilainya tidak tergerus. Juga fleksibel bisa cair kapan aja. 5juta jaman sekarang, nilainya belum tentu sama dengan 5juta pada 30 tahun mendatang.",Thread,http://www.youtube.com/@sriwahyuni-xp9fr,UCUQR6IzhMnVqDJReRjmzgJg,2024-05-31T16:08:42Z,,,,1
