id,date,author,text,type,author_channel_url,author_channel_id,edited_date,parent_post_id,parent_username,direct_reply_to,likes
UgzaMv2AypaE7Yp8A1R4AaABAg,2024-06-02T20:31:23Z,@bersintambunan9270,Jadi petani aja sama wira usaha rakyat biar tak ada incaran olygarki berdasi dalm hal tapera haaaaa,Thread,http://www.youtube.com/@bersintambunan9270,UCj0ujpAxTJiSZ6SVs_VrpiQ,2024-06-02T20:31:23Z,,,,0
UgyyGZPbK-X1mXvsa5J4AaABAg,2024-06-02T20:27:40Z,@bersintambunan9270,Identik mode era masa penjajahan dlm tanaman paksa sewa lahan dutanah sendiri bayar haaa,Thread,http://www.youtube.com/@bersintambunan9270,UCj0ujpAxTJiSZ6SVs_VrpiQ,2024-06-02T20:27:40Z,,,,0
UgwAXgyJK4Q4WgmHj9l4AaABAg,2024-06-02T20:26:38Z,@SabliadiPancasari,KORUPTOOOOOOOPR MERAJA LELA FO NEGERI INI,Thread,http://www.youtube.com/@SabliadiPancasari,UC-7Q9-hopYWpRQOhCg5yjBA,2024-06-02T20:26:38Z,,,,0
UgxAhVWc2W2pjLxXQq14AaABAg,2024-06-02T20:25:37Z,@SabliadiPancasari,KOK ULAMAPADA DIEM NADAK BELA JAMAH NYA YG NNTI MNANGGUNG BEBAN YG BANYAK,Thread,http://www.youtube.com/@SabliadiPancasari,UC-7Q9-hopYWpRQOhCg5yjBA,2024-06-02T20:25:37Z,,,,0
UgxySqdn30FLCKvQ2OV4AaABAg,2024-06-02T20:20:57Z,@bersintambunan9270,Tapera ombuslow penawar nya ite dan hoak untuk alat bungkam bisu buat tuntutan rakyat,Thread,http://www.youtube.com/@bersintambunan9270,UCj0ujpAxTJiSZ6SVs_VrpiQ,2024-06-02T20:20:57Z,,,,0
UgytJSIu1wGIqmPLQTh4AaABAg,2024-06-02T20:06:11Z,@bagushardcolder2558,"BPJS w saldonya hilang entah kmna , dan temen w juga , 4 taun kerja saldo Jamsosteknya 0 😂 bingung nyari kmna",Thread,http://www.youtube.com/@bagushardcolder2558,UCEOHze-WasfGoUbLcn6CAfw,2024-06-02T20:06:11Z,,,,0
UgxKmMmjVXWDd3SRyq54AaABAg,2024-06-02T19:50:33Z,@user-pu6el9br8c,Berapa lama buat satu orang mendapatkan 1unit rumah dalam program Tapera?? dan model rumah dng harga berapa yg sesuai dlm program Tapera??,Thread,http://www.youtube.com/@user-pu6el9br8c,UC1zYL2iZ2XQqcqJqkWmW5qA,2024-06-02T19:50:33Z,,,,0
Ugws1wSAx_7WPEjJH494AaABAg,2024-06-02T19:11:39Z,@user-xd4un9zw4t,"*Bilang aja mo ngutang ma rakyat buat bayar utang ke Tiongkok yang sok gede2an bangun ini itu, yang Biar kliatan Sok Keren itu*",Thread,http://www.youtube.com/@user-xd4un9zw4t,UCKl4EhwAomh9bDm9ClR9cxg,2024-06-02T19:12:10Z,,,,0
UgyfCsi3JN5byCpjXmB4AaABAg,2024-06-02T18:48:54Z,@Elingwaspodo9,"Pemerintah seperti tukang parkir, mau belanja atau enggak pokoknya bayar parkir, entah aman atau enggak atau hilang atau enggak ya tanggung sendiri.

Intinya pemerintah malu, apabila banyak proyek mangkrak, investor tidak ada, ya mau gimana lagi, rakyatlah yg diperas....",Thread,http://www.youtube.com/@Elingwaspodo9,UCO6G4ArIFDQ7qgqTet7kPLA,2024-06-04T06:42:19Z,,,,0
UgzXPk1oNV3JDuXvM1V4AaABAg,2024-06-02T18:35:36Z,@Johntor8888,"Yang gaji 8 juta, baru bisa dapat rumah. sama saja, orang yang susah membantu orang gaji yang lebih tinggi.",Thread,http://www.youtube.com/@Johntor8888,UCJZT9X_lvUTdI4_8bZ-9g9A,2024-06-02T18:35:36Z,,,,0
UgxjliWktVFBITSWrRx4AaABAg,2024-06-02T18:28:39Z,@DAFFA-z,Sya Sebagai Rakyat yg gajinya kecil. Lebih baik Tapera itu ditidakan Tidak dilanjutkan. Bisa dihadikan sarang Korupsi. Seperti Asabri dan Tasfen.,Thread,http://www.youtube.com/@DAFFA-z,UCcduB6BUxWpBXWGIyurEaRQ,2024-06-02T18:28:39Z,,,,1
UgwvV_uc1nh0pWJOgsh4AaABAg,2024-06-02T18:21:27Z,@ZuzanCollection,ini anggota DPR ngomong banyak eee nya,Thread,http://www.youtube.com/@ZuzanCollection,UCeiK4jVE-0r7W6A9uZ9D23g,2024-06-02T18:21:27Z,,,,0
UgxFK9YYXTs2rI0nT1F4AaABAg,2024-06-02T18:05:50Z,@robertsihotang9205,Bgmn hitung2nya dengan pemotongan gaji/upah 3% dengan besaran sekitar umr bisa dapat mendapatkan rumah?. Ini cuma uu dagelan saja.,Thread,http://www.youtube.com/@robertsihotang9205,UCVdB5rXErb_UEe-4IaVLwDA,2024-06-02T18:05:50Z,,,,0
Ugx0QJmh218Of7E9kh14AaABAg,2024-06-02T18:04:09Z,@sayangibuu7806,Korupsi aja banyakin,Thread,http://www.youtube.com/@sayangibuu7806,UC3dognYU1O6QZ7mTgN5m-Mw,2024-06-02T18:04:09Z,,,,0
UgzB2CTqjlMBH7spcXV4AaABAg,2024-06-02T18:03:01Z,@sayangibuu7806,"Rakyat aja yg dungu
Kurang apa sich Allah memberihasil bumi
Emang zaman voc
Filsofi jawa raja naik kereta kencana rakyat ckup berlarian ngejar kereta
Revolusi mental",Thread,http://www.youtube.com/@sayangibuu7806,UC3dognYU1O6QZ7mTgN5m-Mw,2024-06-02T18:03:01Z,,,,0
UgxrYzYCFCyrPYm2jlV4AaABAg,2024-06-02T17:49:29Z,@ZuzanCollection,"Bukan cuman masyarakat aja yang merasakan, bahkan pejabat aja ada yang keberatan🤣🤣 Nabung...??? Apa jaminannya kalo uang bisa diambil ?? Ambil uang bakal kena potongan pajak lagi...",Thread,http://www.youtube.com/@ZuzanCollection,UCeiK4jVE-0r7W6A9uZ9D23g,2024-06-02T17:49:29Z,,,,0
UgzB6N_U8U50OT0_qCx4AaABAg,2024-06-02T17:38:05Z,@yudhawp6468,Kabar jiwasraya???pekerja menjerit.,Thread,http://www.youtube.com/@yudhawp6468,UCxiH-kqSMImDRsvQtJjPkKg,2024-06-02T17:38:05Z,,,,0
Ugz3bqAdjlwLPdajdqV4AaABAg,2024-06-02T17:24:24Z,@user-by3gl4oq7q,"Berbicara mulia kepada masyarakat ketika mereka meminta,tapi bagaimana orang yg korupsi  kenapa tidak bisa d redam itu ,bagaiman kalau hasil korupsi warga d bangunkan rumah , apakah bukan perbuatan mulia juga itu  yg d lakukan penguasa .",Thread,http://www.youtube.com/@user-by3gl4oq7q,UCOvbzOclejq8zMHRskOqDnQ,2024-06-02T17:24:24Z,,,,0
UgyEZNqw0EvGEJFRvzd4AaABAg,2024-06-02T16:59:56Z,@saribumi7549,Hati2 Modus baru bwt koruptor..,Thread,http://www.youtube.com/@saribumi7549,UC4sKCvB7Oe-imNo5EGFFT4Q,2024-06-02T16:59:56Z,,,,0
Ugx8tSw-O1H2sfJ5p994AaABAg,2024-06-02T16:38:38Z,@jhonsembiring959,Pretttt,Thread,http://www.youtube.com/@jhonsembiring959,UChsMTwnDRi15VwdzuAaoc_g,2024-06-02T16:38:38Z,,,,0
Ugy9FBlTo2srmcpZIR94AaABAg,2024-06-02T16:30:24Z,@user-ep9qi7qd7i,"Ini sangat menguntung kam bagi developer pemukiman di perkotaan ,bagaimana dgn buru yg ada di pedesaan",Thread,http://www.youtube.com/@user-ep9qi7qd7i,UCmUuI9NitYNt9iM1xqnFdPA,2024-06-02T16:30:24Z,,,,2
Ugx_ClKLXLNgP4SQ7ux4AaABAg,2024-06-02T16:28:33Z,@usmanal8114,Peraturan tersebut hrs dibatalkan,Thread,http://www.youtube.com/@usmanal8114,UCsmsuaDFplgHJCyOVqZ6kDg,2024-06-02T16:28:33Z,,,,1
UgySJYCdAu_2M32Lrkh4AaABAg,2024-06-02T16:25:01Z,@ettysuryaningsih6024,Suamiku bekerja selama 32th dan selama itu dipotong untk bapetarum stlh pensiun tdk dpt rumah  tp dpt pengembalian 4jt 😂😂bisa untk beli rumah bedes 😂,Thread,http://www.youtube.com/@ettysuryaningsih6024,UC6U4sPjL105ecAKaYJ-NNvA,2024-06-02T16:25:01Z,,,,0
Ugwu11UzbDr-BNEgBP94AaABAg,2024-06-02T16:24:18Z,@Phoe-Andro,"Kata raja konoha nanti kalau sudah berjalan akan terasa manfaatnya. Mungkin salah satu manfaatnya untuk membackup program ""Makan Siang"".",Thread,http://www.youtube.com/@Phoe-Andro,UCugQtZoXzVWjVsT2uA8BcVw,2024-06-02T16:29:33Z,,,,0
UgxZzyeDG1rtz__uufp4AaABAg,2024-06-02T16:21:03Z,@AlfaJeo,banyak yg masih 2jutaan gajinya,Thread,http://www.youtube.com/@AlfaJeo,UCcRMYa0txxrkA9nMY-gYsRg,2024-06-02T16:21:03Z,,,,0
UgwY9j6sev3uxibjJxV4AaABAg,2024-06-02T16:18:39Z,@havirsata8957,"Kenapa tidak di gunakan uang korupsi yg 271 T itu aja untuk membuat rumah masyarakat, tanpa harus melalui TAPERA",Thread,http://www.youtube.com/@havirsata8957,UCT6Ok1N3t21hv8o4QbiSYAg,2024-06-02T16:18:39Z,,,,0
UgzPvPmPr8FCblaAx7F4AaABAg,2024-06-02T16:18:22Z,@ArsyaSatria-o4b,Pbjs sja sudah mencekik. Bayi bru lahir sja sudah nanggung beban,Thread,http://www.youtube.com/@ArsyaSatria-o4b,UC7idWe3KWKKHSUcdLy7I6ww,2024-06-02T16:18:22Z,,,,0
Ugz3zIjTfrL513Z5qQ54AaABAg,2024-06-02T16:18:15Z,@ahmadyani8078,"yang jelasin aja bingung, sumpah lucu ini.",Thread,http://www.youtube.com/@ahmadyani8078,UCpIZnTvI8rEgfIrJF93zLnA,2024-06-02T16:18:15Z,,,,0
UgxQJ5xiOlbwvTFBPvN4AaABAg,2024-06-02T16:18:12Z,@herysusanto6440,wadah korupsi baru buat pengurus TAPERA TOLAK,Thread,http://www.youtube.com/@herysusanto6440,UC5lUaFbO81Fm_EpTK967Tlg,2024-06-02T16:18:12Z,,,,0
UgxZz8Fte6Dx_Jjjo_h4AaABAg,2024-06-02T16:17:51Z,@AlfaJeo,ujung ujungnya banyak bocorrrr....ahhhh,Thread,http://www.youtube.com/@AlfaJeo,UCcRMYa0txxrkA9nMY-gYsRg,2024-06-02T16:17:51Z,,,,0
Ugw7AF_WQ5Yq2Nmsqmh4AaABAg,2024-06-02T16:16:30Z,@ArsyaSatria-o4b,Jembut lah,Thread,http://www.youtube.com/@ArsyaSatria-o4b,UC7idWe3KWKKHSUcdLy7I6ww,2024-06-02T16:16:30Z,,,,0
UgxDeehV7qvmLTIT9mx4AaABAg,2024-06-02T16:16:07Z,@jhonsembiring959,"Sebagian masuk kesaku pengelola spt kasus taspen Asabri, siwasersya 😀😀😀😀",Thread,http://www.youtube.com/@jhonsembiring959,UChsMTwnDRi15VwdzuAaoc_g,2024-06-02T16:16:07Z,,,,0
UgyA7CUi6UAaLJENA1J4AaABAg,2024-06-02T16:12:46Z,@jhonsembiring959,"Mhn maaf, buruh hrs tolak Tapera dananya  nanti patut di duga di salah gunakan/ di korupsi contoh, taspen,asabri,juwa seraya ! Hrsnya pemerintah/ begara yg subsudi rmh bust rakyatnya, ini malag pemerintah/ negsra peras/ paksa byruh nya, aneh negara kita ini ya????😃😃😃😃",Thread,http://www.youtube.com/@jhonsembiring959,UChsMTwnDRi15VwdzuAaoc_g,2024-06-02T16:12:46Z,,,,0
UgwgqXkz3lOyjH0KXpx4AaABAg,2024-06-02T16:12:36Z,@AlfaJeo,gotong royong buat bancakan,Thread,http://www.youtube.com/@AlfaJeo,UCcRMYa0txxrkA9nMY-gYsRg,2024-06-02T16:12:36Z,,,,0
UgzZXO8stFG44E5s0-N4AaABAg,2024-06-02T16:09:52Z,@benitaofficial6514,"Dari penjelasan yang sedikit masuk akal Tapera ini, masalahnya pemerintah sama sekali tak kupercaya saat ini..jadi jgn main maksa nih pemerintah",Thread,http://www.youtube.com/@benitaofficial6514,UCOOw-ck-dB8y9BD_iLsuAww,2024-06-02T16:09:52Z,,,,0
UgxganezntoJ7L-VHLV4AaABAg,2024-06-02T16:07:24Z,@user-me3xb1om3j,"Maksud mulia hanya utk alasan spy bisa ngumpulkan dana .
Alasan yg sebetulnya ya bancaan ujung ujungnya",Thread,http://www.youtube.com/@user-me3xb1om3j,UC49bmY65r4EbbNO0-JgaPuQ,2024-06-02T16:07:24Z,,,,0
UgyMrF3NywUGGRGa9Xh4AaABAg,2024-06-02T16:03:59Z,@jhonsembiring959,UUD 45 rakyat berhak punta rumah itu negara yg berikan pak! Bukan pemerintah / negara paksa uang dari buruh😁😁😁😁,Thread,http://www.youtube.com/@jhonsembiring959,UChsMTwnDRi15VwdzuAaoc_g,2024-06-02T16:03:59Z,,,,0
Ugy1kvdkJyXdpDOioqF4AaABAg,2024-06-02T16:02:46Z,@AiniAini-di5lm,Tapera bukan untuk rakyat tapi untuk para koroptor  haaaaaa.haaaaaaa gaji rakyat dipotong gaji pejabat naik luarbbiasa,Thread,http://www.youtube.com/@AiniAini-di5lm,UC_ApyIhFNp4TSw6YMxll5UQ,2024-06-02T16:02:46Z,,,,0
Ugzu5hSI8wqN70Md9st4AaABAg,2024-06-02T16:01:48Z,@rasnitahrnita1814,Saya nyicil rumah utk apa Tapera kalo gaji dipotong lagi engg makan kami sekeluarga,Thread,http://www.youtube.com/@rasnitahrnita1814,UC6nbzgWAlCOGgm6-aSWa3qg,2024-06-02T16:01:48Z,,,,0
UgxWbOP1FJlsTSeVCFB4AaABAg,2024-06-02T16:01:12Z,@jhonsembiring959,😃😃😃 mungkin uang itu sudah hbs di korupsi pak😀😀😀😀,Thread,http://www.youtube.com/@jhonsembiring959,UChsMTwnDRi15VwdzuAaoc_g,2024-06-02T16:01:12Z,,,,0
Ugz9Qs-k4SX99mA4M694AaABAg,2024-06-02T15:59:13Z,@ristomala889,katanya amanat undang2… apa susahnya rubah undang2 yang memberatkan rakyat… tapi kalau merubah undang2 yang berhubungan kepentingan kelompok cepat kali….,Thread,http://www.youtube.com/@ristomala889,UCCCM0pwMDxfRhk3lRdVWl3Q,2024-06-02T15:59:13Z,,,,0
UgwtynwNq4fLLiAH-a94AaABAg,2024-06-02T15:59:02Z,@AlfaJeo,"yang umk 2.2juta, sudah dipotong bpjs ditamabah lagi ini tabungan GHoiB,,,terima upah berapa,,,bosss,,",Thread,http://www.youtube.com/@AlfaJeo,UCcRMYa0txxrkA9nMY-gYsRg,2024-06-02T15:59:02Z,,,,0
UgxdHDYDK6ZaXBN8PWR4AaABAg,2024-06-02T15:58:19Z,@ojoskurniawan5815,Gobloggf pihak tapera nya aja planga plongo ngejelsinnya hahhaaa,Thread,http://www.youtube.com/@ojoskurniawan5815,UCMDofGF-Q5VgDdYnrI-z31w,2024-06-02T15:58:19Z,,,,0
UgzCH8m6r-CQFtSD3a54AaABAg,2024-06-02T15:57:53Z,@jhonsembiring959,"Mhn maaf, apa preden joko wi, mau bertanggung jawab tidak akan terjadi seperti, kasus, PT Asabri,jiwasersya, Taspen yg sampai saat ini madih bermadalah",Thread,http://www.youtube.com/@jhonsembiring959,UChsMTwnDRi15VwdzuAaoc_g,2024-06-02T15:57:53Z,,,,0
UgyhjsAKQEzVIkxGXlV4AaABAg,2024-06-02T15:56:15Z,@ettysuryaningsih6024,Tapera isoe untk menghilangkan 271T dan memuluskan MA merubah undang2 batas usia pilkada dan jreng uu sdh berubah 😂😂😂,Thread,http://www.youtube.com/@ettysuryaningsih6024,UC6U4sPjL105ecAKaYJ-NNvA,2024-06-02T15:56:15Z,,,,0
UgxsiwwayHgGMWW61sp4AaABAg,2024-06-02T15:56:10Z,@AlfaJeo,jangareeeeeeee......kebanyakan upetiiii...GhOIB,Thread,http://www.youtube.com/@AlfaJeo,UCcRMYa0txxrkA9nMY-gYsRg,2024-06-02T15:56:10Z,,,,0
Ugxt-CLbjSvDukvLabh4AaABAg,2024-06-02T15:54:27Z,@jhonsembiring959,"Mhn maaf, BPK BPK, kebijakan Tapera aneh dan ajaib' masak buruh di paksa",Thread,http://www.youtube.com/@jhonsembiring959,UChsMTwnDRi15VwdzuAaoc_g,2024-06-02T15:54:27Z,,,,0
UgwgxNyOaWwYNFtgejx4AaABAg,2024-06-02T15:50:53Z,@jakarta1963,Hancur sudah indonesiaku tercinta,Thread,http://www.youtube.com/@jakarta1963,UCI_1vu_72Z_rsTVaCuYTacg,2024-06-02T15:50:53Z,,,,0
Ugy3CaCPoFWNcC5iZ314AaABAg,2024-06-02T15:48:47Z,@rickykurniawan5355,Tabungan Penderita Rakyat dk ikhlas untuk di korupsi selama koruptor masih dipelihara,Thread,http://www.youtube.com/@rickykurniawan5355,UC4crY-W747C1XwMVojXNefQ,2024-06-02T15:48:47Z,,,,0
UgxcOVXovjj8NAiwSsx4AaABAg,2024-06-02T15:46:50Z,@nursalim4199,KAYAK NYA HARUS MENABUNG DAN SUSAH DI AMBIL SEWAKTU2... NUNGGU SAMPAI MAMPUS MUNGKIN ITUPUN SULIT DI AMBIL.. KALO MENINGGAL ATAU DI PHK GIMANA ???.  YG PAKEK OTAK LAH.,Thread,http://www.youtube.com/@nursalim4199,UCcECRHu1cyRuxwnId2xTU4A,2024-06-02T15:46:50Z,,,,0
Ugw4wsH0xzKpxJ_bXix4AaABAg,2024-06-02T15:41:26Z,@radenmulyana6135,"AWAS tepu tepu lagi,,,,!??!!!",Thread,http://www.youtube.com/@radenmulyana6135,UCdoSbfeQnP0FVnubzC2x8hw,2024-06-02T15:41:26Z,,,,0
Ugyegeu-tnqRLqF_j9Z4AaABAg,2024-06-02T15:40:04Z,@user-me3xb1om3j,Jimpitan beras di RT,Thread,http://www.youtube.com/@user-me3xb1om3j,UC49bmY65r4EbbNO0-JgaPuQ,2024-06-02T15:40:04Z,,,,0
A4BVZ-YxmxCA4BWtVVZ2TT,2024-06-02T15:51:45Z,@user-me3xb1om3j,Masak Tapera mau disamakan dg jimpitan beras,Reply,http://www.youtube.com/@user-me3xb1om3j,UC49bmY65r4EbbNO0-JgaPuQ,2024-06-02T15:51:45Z,Ugyegeu-tnqRLqF_j9Z4AaABAg,@user-me3xb1om3j,,0
UgzCTI2QFgcsdPdOfhx4AaABAg,2024-06-02T15:39:28Z,@armadasupardi3586,GAra2 58% 200jt rakyat kena imbasnya😀,Thread,http://www.youtube.com/@armadasupardi3586,UC9DluNG44Xb4Zy6qF0OeM_g,2024-06-02T15:39:28Z,,,,0
Ugzw20tJ7qdzMmHFvqh4AaABAg,2024-06-02T15:38:56Z,@user-me3xb1om3j,"Tabungan sekolah
Tabungan pramuka
Tabungan koperasi


Tapera gak bisa dibuat spt itu .
Krn pemerintah gak bisa dipercaya.",Thread,http://www.youtube.com/@user-me3xb1om3j,UC49bmY65r4EbbNO0-JgaPuQ,2024-06-02T15:48:55Z,,,,0
UgyoOMZtfoYyi0H7pTx4AaABAg,2024-06-02T15:38:27Z,@AnglerSugeng,Tapera untuk di korupsi,Thread,http://www.youtube.com/@AnglerSugeng,UC4Iwcwkb9fxuPdkIMTbkMuw,2024-06-02T15:38:27Z,,,,0
UgxvC8R-bgvNR50115l4AaABAg,2024-06-02T15:30:47Z,@boedirajudinvlog,"Ayo kita kasih semangat buat para pendukung no 2 , ini kan yang kalian mau?
Siapin dulu rumah nya maliiih...!!",Thread,http://www.youtube.com/@boedirajudinvlog,UCGi-gDuyax5Qx4irqZEsxEw,2024-06-02T15:32:17Z,,,,3
UgwyeRJWXqn2oOz4aj94AaABAg,2024-06-02T15:21:37Z,@ojoskurniawan5815,Tu duit ujungnya lari ke ikn,Thread,http://www.youtube.com/@ojoskurniawan5815,UCMDofGF-Q5VgDdYnrI-z31w,2024-06-02T15:21:37Z,,,,0
UgyJeL-AFJ-mTBTwPtN4AaABAg,2024-06-02T15:17:28Z,@idaabady8778,"Buatlah undang"" hukum mati koruptor dulu.....rakyat pasti sejahtera.......pemerintah g perlu pusing"" mlintir berbagai undang""",Thread,http://www.youtube.com/@idaabady8778,UCIMSGUrP2vGKENRcV6FuyDg,2024-06-02T15:17:28Z,,,,1
UgxyNxE7tRnC2vK9Gkd4AaABAg,2024-06-02T15:15:24Z,@rudisukarsa1493,"Penabung Mulia 😂😂😂😂😂
hrsny Pemerintah yg Mulia
TAPERA engak lbh ngumpulin uang rakyat buat dibeliin SUN
Krn tdk dikelola dg mulia negeri ini
jd kesulitan cukupin APBN. 
Btw .. CPI 33 mau omong apa",Thread,http://www.youtube.com/@rudisukarsa1493,UCNd0udJkfxmu541uQIzsn_Q,2024-06-02T15:15:24Z,,,,0
UgwUwjfG0Un8nUtEoPF4AaABAg,2024-06-02T15:10:28Z,@muhammadrachman2933,Udah lah dpr jangan di gol kan masala tapera hanya mengalihkannisu korupso yg kayanya triliunan,Thread,http://www.youtube.com/@muhammadrachman2933,UCXSnnZCgGqz3jk5KenM9H0A,2024-06-02T15:10:28Z,,,,0
Ugz7YwF2FnJsA4RT5U54AaABAg,2024-06-02T15:08:49Z,@muhammadrachman2933,Dari uang hasil bumi aja untuk p3mbuatan rumah .kan bisa tuh dari uang korup so kata yg jumlah nya sangat banya sampai triliunan  kam bisa  tuk kesejahtraan rakyat. Jangan bisa nya ngomong gede aka,Thread,http://www.youtube.com/@muhammadrachman2933,UCXSnnZCgGqz3jk5KenM9H0A,2024-06-02T15:08:49Z,,,,0
UgyMLZ6W5XUvj7KcOFh4AaABAg,2024-06-02T15:07:33Z,@ramliramli5673,"Sudah lah mendingan pemerintah ngurusin yg lain saja biar kan kami buruh memneli rumah sendiri aja ,",Thread,http://www.youtube.com/@ramliramli5673,UCya74AJf6b85FP7xjUgp1Bg,2024-06-02T15:07:33Z,,,,0
UgyAJh1oMIeVs0rd2L94AaABAg,2024-06-02T15:00:06Z,@rullymansyah6511,"Coba tanya ke ketua tapera, bila buruh  di kontrak hanya bekerja 1-2 tahun dan sudah tidak bekerja kembali bagaimana?.",Thread,http://www.youtube.com/@rullymansyah6511,UCOkyqspC9ZPAmx7ekU9L8xg,2024-06-02T15:00:06Z,,,,1
UgyhBTplUUVl28UYB_x4AaABAg,2024-06-02T14:58:50Z,@HermanSyb,"3,nama,dalam,1,target!!!,",Thread,http://www.youtube.com/@HermanSyb,UC4NDcvbZHvlm6D-m-AX6FJg,2024-06-02T14:58:50Z,,,,0
UgwAaJVW2y-QiAJwrw14AaABAg,2024-06-02T14:58:03Z,@awierocket,Kegunaan Tapera adalah untuk ladang baru korupsi.,Thread,http://www.youtube.com/@awierocket,UC33Fn8UPGmbczHZ0FBNut8w,2024-06-02T14:58:03Z,,,,0
UgyONRnwGArDA-JfmvZ4AaABAg,2024-06-02T14:55:58Z,@herukartiko1030,Tapera akan dibuat ladang baru untuk korupsi..seperti tabungan rakyat lainnya..,Thread,http://www.youtube.com/@herukartiko1030,UCnx5WFoAGJUEVItKH-XATlQ,2024-06-02T14:55:58Z,,,,0
Ugz98ntqKFs4Wh-6Tvt4AaABAg,2024-06-02T14:54:51Z,@abahnurcahyoflog1389,"Semua cari muka....kalo memang saat ini Indonesia merencanakan sistem hidup di NKRI untuk menjadi negara maju.... tetapi para elit membuat masyarakat kecil tambah binggung...padahal mereka tahu entang Tapera...
Kalo nanti apartemen sdh di bangun dan masyarakat harus bertempat di apartemen tersebut baru diam....ini mempercepat proses imigrasi sosial dari manual life ke tehnikal life.....ya kalo perkiraan saya benar...tapi itu yg sy perkirakan.....",Thread,http://www.youtube.com/@abahnurcahyoflog1389,UCYYP1W8WXahcSU2sjOpwZCQ,2024-06-02T14:54:51Z,,,,0
UgzCYDB82ELWZPjqmdx4AaABAg,2024-06-02T14:51:03Z,@rullymansyah6511,Kalau tapera di berlakukan maka pengusaha akan berpikir keras untuk menjadikan karyawan menjadi karyawan tetap.,Thread,http://www.youtube.com/@rullymansyah6511,UCOkyqspC9ZPAmx7ekU9L8xg,2024-06-02T14:51:03Z,,,,2
UgwoeCzM7ho-CTcKo1x4AaABAg,2024-06-02T14:42:57Z,@ikhsanaja3690,"Keparatttt,selalu mencari cari celah untuk keuntungan pribadi,tapi menyangsarahkan rakyat,masih kurang dan kurang terus menguras dan merampok uang rakyat",Thread,http://www.youtube.com/@ikhsanaja3690,UCCOH2TEjHzPPTXO9ZepEq2g,2024-06-02T14:42:57Z,,,,0
UgxXHBecLUpXTFQzVH94AaABAg,2024-06-02T14:38:30Z,@ruckuz9903,Preman berdasi 👍☠️,Thread,http://www.youtube.com/@ruckuz9903,UCsKEtXqKDbDzh8KltHjS4rQ,2024-06-02T14:38:30Z,,,,0
UgwM4fzWlsl4ZZ-ogoN4AaABAg,2024-06-02T14:35:16Z,@ramliramli5673,Itu akibat nya kalau Undang undang selalu di sah kan secara ujuk ujuk  dan terselubung he he he,Thread,http://www.youtube.com/@ramliramli5673,UCya74AJf6b85FP7xjUgp1Bg,2024-06-02T14:35:16Z,,,,0
Ugwt6s-wVi7mDo78_Ol4AaABAg,2024-06-02T14:35:03Z,@cahbanterkurirbalap9946,😅😅😅😅😅,Thread,http://www.youtube.com/@cahbanterkurirbalap9946,UCk6w7tpTf82z2hvXWvZFAog,2024-06-02T14:35:03Z,,,,0
UgyoP4c-7EIBkqWd7xh4AaABAg,2024-06-02T14:31:22Z,@yuliekopraptomo1621,Kebijakan yg tdk pakai otak dan hati nurani ..!!,Thread,http://www.youtube.com/@yuliekopraptomo1621,UCwpn_7r7FEIJ67uLm3bspcw,2024-06-02T14:31:22Z,,,,0
Ugw2Zfth348fkzuZp_F4AaABAg,2024-06-02T14:29:47Z,@davidderira1662,Pungli gaya baru...,Thread,http://www.youtube.com/@davidderira1662,UCHj8wk8wYrFM6kVCD6OgXZQ,2024-06-02T14:29:47Z,,,,0
Ugz_pynvI1136rLkMVt4AaABAg,2024-06-02T14:26:11Z,@ruckuz9903,Apa konten ini bisa dilihat oleh pemerintah 👹,Thread,http://www.youtube.com/@ruckuz9903,UCsKEtXqKDbDzh8KltHjS4rQ,2024-06-02T14:26:11Z,,,,0
UgwbuFF-FGxWuGF1NFB4AaABAg,2024-06-02T14:20:37Z,@manihardimanihardi2417,"AS ABRI, Asuransi jiwa sraya sekarang bikin lubang lagi Tapera untuk mencari uang untuk dikeruk dan dikoropsi oleh penguasa dan pejabat",Thread,http://www.youtube.com/@manihardimanihardi2417,UC5-NUaCnx7qL-Hr8NOxu-oA,2024-06-02T14:20:37Z,,,,0
UgyQ5bnKuKV-gETOFRx4AaABAg,2024-06-02T14:17:41Z,@lilyksupriadhi3679,"TAPERA tidak ada yang Pro, semuanya kontra, cuk...dancuk",Thread,http://www.youtube.com/@lilyksupriadhi3679,UC8U4tXDpD__9dTzEUZsR1_w,2024-06-02T14:17:41Z,,,,0
Ugw5hSIEvqmQJ10OdwV4AaABAg,2024-06-02T14:13:24Z,@PirmansaPirman-xo4bt,Tenang aja sebentar lagi indonesia bukan di pimpin orang bodo pasti ada tolesansi dari pimpnan tertinggi.,Thread,http://www.youtube.com/@PirmansaPirman-xo4bt,UCb-lYRiKsLQkWVZKJHlYx5Q,2024-06-02T14:13:24Z,,,,0
UgwcKKx8wkMkMNHEzON4AaABAg,2024-06-02T14:11:43Z,@makangaming3011,Jojokowi udh mau pensiun  bikin pp ini itu mikir   dulu lgi 4 bln kmu sdh bkn siapa2 lagi,Thread,http://www.youtube.com/@makangaming3011,UC71NIyLh8xg8qS60S2knrXA,2024-06-02T14:11:43Z,,,,0
UgzlXwQHM-zOHSGWonB4AaABAg,2024-06-02T14:11:27Z,@agussapariofficial,akibat banyak hutang,Thread,http://www.youtube.com/@agussapariofficial,UCy1kMDjtPPBxM1oSNaT9ddg,2024-06-02T14:11:27Z,,,,0
UgyqDPj-Y4HobKTQoeR4AaABAg,2024-06-02T14:09:21Z,@fauzanharis6217,Mantep betull Bu Elly jooss.   Memihak rakyat kecil ❤❤❤,Thread,http://www.youtube.com/@fauzanharis6217,UCJJh0utd-uSzb2bs9zPulvg,2024-06-02T14:09:21Z,,,,6
UgzmCM0DtgBHjM0mPeV4AaABAg,2024-06-02T14:07:53Z,@widhinugroho2072,Akal akalan aja... Cari dana buat makan siang gratis 🤣🤣🤣🤣,Thread,http://www.youtube.com/@widhinugroho2072,UCC14Eknnppsnc1R5MHWUzNA,2024-06-02T14:07:53Z,,,,0
UgwUSilS-1p9cffncSh4AaABAg,2024-06-02T14:01:53Z,@atangsalim9464,Tapera  tambh perampog rakyat,Thread,http://www.youtube.com/@atangsalim9464,UCOtMEQ0338pxIvtP2USISBg,2024-06-02T14:01:53Z,,,,0
UgzYDc71xzksIDD-BVB4AaABAg,2024-06-02T14:00:06Z,@BudiPrayitno-f4s,Kami curiga kalau Tapera usulan dari pengusaha properti yg selama pendemi sulit laku padahal untuk membangun kredit bank dan juga pabrik semen over produksi karena pembangunan infrastruktur berkurang,Thread,http://www.youtube.com/@BudiPrayitno-f4s,UCnk5PRWDj36UQzw5D0e-0Bg,2024-06-02T14:00:06Z,,,,0
UgzcAajVsCPaeGIq_P54AaABAg,2024-06-02T13:56:41Z,@misbahulmunir528,"Hai wakil rakyat, gak usah mal malu setujui saja itu aturan, gak usah kau pikir itu rakyat, kan waktu pemilihan dulu calon wakil rakyat sudah ....... suara, sekarang sudah saatnya  kau menjabat  ........ modal yg dulu di bagi bag. 

Wahai penguasa dan wakil rakyat
Untuk menyempurnakan bentuk penekanan mu terhadap rakyatnya adalah keluarnya kata ""wajib""",Thread,http://www.youtube.com/@misbahulmunir528,UC6Vnb9GskDOpdFpNSaTcjgw,2024-06-02T13:56:41Z,,,,0
Ugz9sYg0Q9raesu_PUl4AaABAg,2024-06-02T13:56:08Z,@user-ht8ii3xl3c,TAPERA...Tak Punya pERAsaan,Thread,http://www.youtube.com/@user-ht8ii3xl3c,UCvIkcTbOCfpH-Atz0ZXv_5Q,2024-06-02T13:56:08Z,,,,0
UgymqcjvUnnEdYTCabR4AaABAg,2024-06-02T13:55:52Z,@dewiiriana2950,cobatuh para pejabat yang banyak duitnya di suruh bikun perumahan untuk dicicil oleh rakyat yg mau rumah,Thread,http://www.youtube.com/@dewiiriana2950,UCuGQEjAWJU5Gx1aNJN0Z1gA,2024-06-02T13:55:52Z,,,,0
UgzUWq37dGybzbVrOAV4AaABAg,2024-06-02T13:53:52Z,@dewiiriana2950,"kenapa pemerintah tidak membuat perumahan lalu rakyst yg mau, baru nyicil",Thread,http://www.youtube.com/@dewiiriana2950,UCuGQEjAWJU5Gx1aNJN0Z1gA,2024-06-02T13:53:52Z,,,,0
UgxpEFdhOSjpY8got3l4AaABAg,2024-06-02T13:52:30Z,@abidzaralmunni5633,Nanti menabung sendiri ok,Thread,http://www.youtube.com/@abidzaralmunni5633,UCJgg_VA_h-P5r-Nz439B3JQ,2024-06-02T13:52:30Z,,,,0
UgyalbfO0xU5ad6oCVF4AaABAg,2024-06-02T13:52:13Z,@MbahSalman-bt3op,Sistem Tapera yang dijalankan jowi sangat tidak sehat. Sebaiknya Tapera dihentikan.,Thread,http://www.youtube.com/@MbahSalman-bt3op,UC0wIMtRpd3ZKqgxxco-Ox3w,2024-06-02T13:52:13Z,,,,0
Ugxkt03B8zL2UEJVgq54AaABAg,2024-06-02T13:51:39Z,@abidzaralmunni5633,Kalau rakyat tidak setuju batalkan terbentuk negara lndonesia ada rakyat kalau tidak ada rakyat pemerntaha dan tidak ada megara jgn dipaksakan rakyet,Thread,http://www.youtube.com/@abidzaralmunni5633,UCJgg_VA_h-P5r-Nz439B3JQ,2024-06-02T13:51:39Z,,,,0
UgwJ21wMUZ_XARL1mUh4AaABAg,2024-06-02T13:51:24Z,@donianz,"Ibu saya pensiuan pns, dulu ikut bapetarum… pas penisun di cairkan ga cukup buat renov apalagi beli rumah. Cuma kebeli kasur doang pak..!!!",Thread,http://www.youtube.com/@donianz,UCAP7pcaUlqf71PajOFTsz7w,2024-06-02T13:51:24Z,,,,0
UgwJglxL3h2hnnrkQjJ4AaABAg,2024-06-02T13:50:12Z,@dewiiriana2950,para petugas yg berkaitan dengan tapera apakah di beri gajih? darimana bayar gajihnya?,Thread,http://www.youtube.com/@dewiiriana2950,UCuGQEjAWJU5Gx1aNJN0Z1gA,2024-06-02T13:50:12Z,,,,0
UgyED7uG-IMOT7FsdTR4AaABAg,2024-06-02T13:48:03Z,@marsihsumariyati2730,Inilah pemimpin yg di gu otak bocor,Thread,http://www.youtube.com/@marsihsumariyati2730,UCWElFP9SZ3nEoUCM_zh7D-w,2024-06-02T13:48:03Z,,,,0
Ugztacc86k4nDFhMM2V4AaABAg,2024-06-02T13:46:05Z,@YadiYuda-rf2oc,Tolong dipikirkan orang yg kerja di PT tak mungkin sampai  30 Th  mending  Rumah  dulu yg diberikan jadi kalau setoran tak lancar  Rumah bisa dijual.,Thread,http://www.youtube.com/@YadiYuda-rf2oc,UChrs4Exe5bpHiZqqY--qWhg,2024-06-02T13:46:05Z,,,,0
UgyonAciw0q_Way7ojR4AaABAg,2024-06-02T13:39:30Z,@user-ne2qn6kx7w,Mencetak lahan KORUPSI baru,Thread,http://www.youtube.com/@user-ne2qn6kx7w,UCkmurXACy1yyvBRO7jKFF1Q,2024-06-02T13:39:30Z,,,,0
