id,date,author,text,type,author_channel_url,author_channel_id,edited_date,parent_post_id,parent_username,direct_reply_to,likes
UgzSlRVK48rYgBcybtt4AaABAg,2024-05-30T15:26:29Z,@MrBorrell91,"saya suka dan setuju untuk nabung... tapi jangan diarahkan ke satu kebutuhan saja, kebutuhan primer dan prioritas masyarakat berbeda beda. saya kira tetap arahkan dan fasilitasi masyarakat menabung dan bebaskan saja masyarakat menggunakan tabungannya untuk kebutuhan primer dan prioritasnya masing-masing,",Thread,http://www.youtube.com/@MrBorrell91,UCAO8ogkpEOgM58pLnhABWGQ,2024-05-30T15:26:29Z,,,,0
Ugyx-KjaTwuG0WEpgrV4AaABAg,2024-05-30T15:23:07Z,@cahaya237,"Bingung...maen teken aje tuh praturan...yakin banget pd setuju... ruwet...ruwet,.. ruwet",Thread,http://www.youtube.com/@cahaya237,UCpsWU-7bVpqdZft5zB--4aA,2024-05-30T15:23:07Z,,,,0
UgxYJuby-E68vr9rFOJ4AaABAg,2024-05-30T15:19:46Z,@agusnuryawan5197,"TAPERA =
 ( TABUNGAN PRABOWO)
😂😂😂😂😂😂😂😂😂",Thread,http://www.youtube.com/@agusnuryawan5197,UCWFtGczah4U7b4IMr3bhlkQ,2024-05-30T15:19:46Z,,,,0
UgyKqq7HF35JFcGkZMt4AaABAg,2024-05-30T15:19:42Z,@B4m3g4ku,SATU KATA.. TOLAAAK,Thread,http://www.youtube.com/@B4m3g4ku,UCJqDdXqwqQB1SH4UA5F6Jwg,2024-05-30T15:19:42Z,,,,0
Ugwh6YIaunE3EEDyi954AaABAg,2024-05-30T15:19:28Z,@helmipajero,"Program tidak logik. Jika tidak punya rumah, kasi saja kredit lunak, untuk apa tabungan yg diwajibkan.",Thread,http://www.youtube.com/@helmipajero,UChOfRsBWCwt1lK7FqMVovew,2024-05-30T15:19:28Z,,,,0
Ugwi5SSfdP7PM1_eke54AaABAg,2024-05-30T15:18:31Z,@multiponsel7728,Buruh gk setuju .,Thread,http://www.youtube.com/@multiponsel7728,UCao_dDGZlhIAXNLfL0ImXYA,2024-05-30T15:18:31Z,,,,0
Ugx4lPq1jMAHTCrfQut4AaABAg,2024-05-30T15:17:59Z,@sok_hayang_nyaho,😂😂😂😂😂 ngajelasken na ge pabeulit ...,Thread,http://www.youtube.com/@sok_hayang_nyaho,UC-NS7J2qD69Gr82hTS08YUA,2024-05-30T15:17:59Z,,,,0
UgycedzKVvD97FpdvBZ4AaABAg,2024-05-30T15:16:26Z,@Firania-gn3eq,Dah nyicil rmh sndiri pak. Klo ada uang lebih mending ditabung sendiri buat sekolahin anak. Ga usah diwajibkan tapera2an,Thread,http://www.youtube.com/@Firania-gn3eq,UCveWFsZufLwQqkPyHyFA-4w,2024-05-30T15:16:26Z,,,,0
Ugy-ridXZs-OP9mtaT94AaABAg,2024-05-30T15:14:28Z,@onatal403,BATALKAN TAPERA!!!!,Thread,http://www.youtube.com/@onatal403,UCLPwdxsRjo8fv057o0jzUkA,2024-05-30T15:14:28Z,,,,1
UgyVsCEM7EFsERAySKx4AaABAg,2024-05-30T15:13:55Z,@user-cc4be8sl2w,"TAhapan PEmerasan RAkyat
Hedop raja konoha",Thread,http://www.youtube.com/@user-cc4be8sl2w,UCoA_l1PO944YbjnOFptw_zA,2024-05-30T15:14:49Z,,,,0
Ugy2B8w7-CUqXhCWcGl4AaABAg,2024-05-30T15:07:55Z,@AdeJunaedi-pt4ff,"Yg cari untung pemerintah ..
Pinjem uang tidak pake bunga warga pinjem uang pake bunga ke bank 
Liat tuh ...dana haji ...?",Thread,http://www.youtube.com/@AdeJunaedi-pt4ff,UCZxr3YH72lkJKrFGBFZ6ctg,2024-05-30T15:07:55Z,,,,0
Ugzkg8Gv4qjMB54ff1J4AaABAg,2024-05-30T15:07:19Z,@jamscocolomel959,Gw yakin klo tidak diwajibkan pasti gk akan ada yg ikut program ini..,Thread,http://www.youtube.com/@jamscocolomel959,UCjIWlQqH-6uXKH6_v6_QKQQ,2024-05-30T15:07:19Z,,,,8
Ugyzn9GuyJzab_bw9b54AaABAg,2024-05-30T15:03:22Z,@daryanata7267,"Bumi Putera, Jiwasraya, ASABRi, dll.,   menggerus kepercayaan terhadap ide2 penggalangan dana rakyat... 
KEPERCAYAAN!",Thread,http://www.youtube.com/@daryanata7267,UCmfEWEEWAWyyqRqXVEgE7Wg,2024-05-30T15:03:22Z,,,,0
Ugx-C3keYTBI1S1C6ep4AaABAg,2024-05-30T15:02:43Z,@GonoPlapon-yu6bh,Ada 1 orang yg memalukan menurut pandangan saya. Astaqfirllohhhhhhhh,Thread,http://www.youtube.com/@GonoPlapon-yu6bh,UCcP6BMCutfzUO_C312oNrww,2024-05-30T15:02:43Z,,,,0
UgxT1oxzyZrWYoWFyWN4AaABAg,2024-05-30T15:02:11Z,@SyahrulRomadhon10,Yang menolak itu supaya yang miskin tetap miskin yang kaya tetap kaya,Thread,http://www.youtube.com/@SyahrulRomadhon10,UCZU8lNG2YRJNRlb6-yJJ4YQ,2024-05-30T15:02:11Z,,,,0
A43hprKDauiA43zya7Lwcj,2024-05-30T17:40:39Z,@herudento9922,Tanggung jawab pemerintah kok dibebankan ke pekerja. Auto gebleg,Reply,http://www.youtube.com/@herudento9922,UCZU8lNG2YRJNRlb6-yJJ4YQ,2024-05-30T17:40:39Z,UgxT1oxzyZrWYoWFyWN4AaABAg,@SyahrulRomadhon10,,0
UgzznG3Qa6ZSs9mxxHR4AaABAg,2024-05-30T15:01:28Z,@wienarnowienarno662,Semestinya pemerintah harus peka. MENGAPA TABUNGAN DI BANK MENYUSUT ?  Alih alih sekarang dipaksa harus menabung.,Thread,http://www.youtube.com/@wienarnowienarno662,UCGhXcWnrEsQ4neydunYR6Jw,2024-05-30T15:01:28Z,,,,2
UgwkwWG4XseMsF9stAh4AaABAg,2024-05-30T14:54:14Z,@supardimadur3931,"Mohon maaf kalau salah ingat nanti kalau mati biar rakyat banyak mendoakan husnul hotimah kalau ingin bantu rakyat contoh peresiden soeharto rakyat di ransmigrasikan dikasih rumah sawah ladang olehh pemerintah ,di kota di bangun RSS ,tanpa uang muka kredit ringan contoh bpjs lihat lahan korupsi sama tapera ini subur untuk koruptor di dalam nya karena banyak yg punya rumah tidak tidak ambil rumah itu kemudian pengusaha rata rata pendapatan nya tinggi apa di ikut sertakan ini sekarang sarjana s 1 gaji 3 juta anak tiga sedang sembako harga naik terus biaya sekolah makin tinggi sbenarnya pemerintah perhatikan yg gaji cuma 3 juta s 1 lagi itu yg di bahas dulu baru pajak jadi TAPERA INI UNTUK  KORUPTOR KARENA BANYAK YG punya rumah di haruskan beda sama bpjs untuk kesehatan itu kemanusian itu pun banyak keluhan masyarakat masalah pelayanan alasan nya dana habis sedang tiap bulan masyarakat bayar itu bukan hanya karyawan hampir seluruh masyarakat kalau ini cuma karyawan peluang kkn lagi orang yg tidak seharus nya dapat bagian INDONESIA belum bisa contoh bansos blt yg seharus nya tidak dapat di beri karena keluarga nya pejabat mohon maaf kalau salah",Thread,http://www.youtube.com/@supardimadur3931,UCimvkaCH3hcJtTqQbQV1z1w,2024-05-30T14:54:14Z,,,,0
UgxoyhG3Pijr74ikPzh4AaABAg,2024-05-30T14:51:23Z,@dedipurwanto6976,Lahan korupsi,Thread,http://www.youtube.com/@dedipurwanto6976,UCzlH5Cv_7HapTfyoQ7ovtXA,2024-05-30T14:51:23Z,,,,0
UgzDjMMkUojDcW3qXJd4AaABAg,2024-05-30T14:50:20Z,@Andrian_gen_official,"Semua kebijakan bagus asal tidak di korupsi, jadi penyakitnya ( Korupsi ) dulu dihilangkan baru buat kebijakan pak, kuncinya miskinkan dan hukum mati koruptor dijamin Indonesia tidak butuh pungut pajak besar besar untuk mendukung program pemerintah.",Thread,http://www.youtube.com/@Andrian_gen_official,UCFaOGhk9T9ex6jm3YeMmh3Q,2024-05-30T14:50:20Z,,,,0
Ugz7USxrHYy-O6lygoJ4AaABAg,2024-05-30T14:50:20Z,@user-yj5xw4ti7i,Kegunaannya untuk apa ? Manfaatnya utk siapa ? Untuk di korupsi ?,Thread,http://www.youtube.com/@user-yj5xw4ti7i,UCEGxZxnoKezRUR4gaEFgjrg,2024-05-30T14:50:20Z,,,,0
Ugwm12ulUJISQz6OJfl4AaABAg,2024-05-30T14:50:01Z,@MuhRojikn,Aku sih Setu aja asal pemerintah memberi aku uang 1milyar la tiap bulan setor kepemerintah 1jt,Thread,http://www.youtube.com/@MuhRojikn,UCPf9vrO05liNRJR_Tt_ywIg,2024-05-30T14:50:01Z,,,,0
UgxGdIOG7LQMDN43mid4AaABAg,2024-05-30T14:48:17Z,@ahmadbuwaeti8507,"Intinya mau dipinjam dgn cara ini , buat pembiayaan ikn",Thread,http://www.youtube.com/@ahmadbuwaeti8507,UCTvHODD0ir3riMdTqwx-wEQ,2024-05-30T14:48:17Z,,,,2
UgwyuCP2tIkEia89clR4AaABAg,2024-05-30T14:48:01Z,@mymelody9698,GAK USAH SOK MAU MBANTU.... KEMANA AJA PEMERINTAH SELAMA 10TAHUN INI.... KAMI BERJUANG SENDIRI BUAT SURVIVE,Thread,http://www.youtube.com/@mymelody9698,UCW89xWrx1MjYauEyILcBRcw,2024-05-30T14:48:01Z,,,,0
UgyCH-5QdrepTG2mggp4AaABAg,2024-05-30T14:47:24Z,@mymelody9698,GAK PERLU DI REVIEW...TAPI DIBATALKAN....,Thread,http://www.youtube.com/@mymelody9698,UCW89xWrx1MjYauEyILcBRcw,2024-05-30T14:47:24Z,,,,0
Ugw6oO2H6Jlo8p5tuYV4AaABAg,2024-05-30T14:44:29Z,@caroluslwanga2358,"Buat pendanaan makan gratis, wkwkwk",Thread,http://www.youtube.com/@caroluslwanga2358,UC-OcXKSwzoFQzoRNQ6V6hlw,2024-05-30T14:44:29Z,,,,0
Ugx5dF2vydRvPEL9Qkd4AaABAg,2024-05-30T14:44:01Z,@mymelody9698,sudah masuk berita internasional soal tapera ini. Negara lawak emang.... tp gpp biarin aja biar negara2 pendukung jk* jd ketua PBB tau hahahaha,Thread,http://www.youtube.com/@mymelody9698,UCW89xWrx1MjYauEyILcBRcw,2024-05-30T14:44:01Z,,,,0
UgzmKBD2zarpBmKqzpN4AaABAg,2024-05-30T14:43:27Z,@x-man1840,"Jiwasraya & asabri aja lom kelar udah mau tipu-tipu lagi, parah lo di mukidi.... 😎",Thread,http://www.youtube.com/@x-man1840,UCMpjZpSWDoXnUF3gZu1a5nQ,2024-05-30T14:43:27Z,,,,0
UgxoBLF_bQLZfWAh85h4AaABAg,2024-05-30T14:42:12Z,@aryatiwidyasari516,Menolak tapera,Thread,http://www.youtube.com/@aryatiwidyasari516,UCdfxOb4Znz4q6tcV08SYstw,2024-05-30T14:46:55Z,,,,0
UgzPcr8vokMtL5dC1QN4AaABAg,2024-05-30T14:41:19Z,@mymelody9698,"halahhh supaya persentase jumlah rakyat miskin aja bisa dimainin dgn nurunin kategori pendapatan rendah (dianggab miskjn kalo makan sehari 11rb), drmn jaminan NAB gak dimainin",Thread,http://www.youtube.com/@mymelody9698,UCW89xWrx1MjYauEyILcBRcw,2024-05-30T14:41:19Z,,,,0
UgxBD48XgJU4_mSMIYB4AaABAg,2024-05-30T14:41:14Z,@joko8128,Lebih baik pendidikan yang dipikirin untuk rakyat.,Thread,http://www.youtube.com/@joko8128,UCoTQj2cR5ow2V44zkKrgRuw,2024-05-30T14:41:14Z,,,,0
UgypLDvB-JqUPhBxHOl4AaABAg,2024-05-30T14:41:11Z,@abdulbasir3637,Untuk dikorupsi😅😅😅😅,Thread,http://www.youtube.com/@abdulbasir3637,UCrpdOsU_RcKFjNZwkVsXnTA,2024-05-30T14:41:11Z,,,,0
Ugzt7H4hmIEJmnQdAOF4AaABAg,2024-05-30T14:40:19Z,@TambatuahSaragih,"Dulu sfh ada, Ba Pel Tarum,,  Sekrng Ta Pera...Apo bedanya...???",Thread,http://www.youtube.com/@TambatuahSaragih,UC-l8g2NGPAUNtyKGfLOsmAw,2024-05-30T14:40:19Z,,,,0
UgwFR4jaKjkxV7XrUUh4AaABAg,2024-05-30T14:38:12Z,@andisaputra6094,Mungkin rumah kardus ya,Thread,http://www.youtube.com/@andisaputra6094,UCv6yu1I5LuOa8w1QdGedE-Q,2024-05-30T14:38:12Z,,,,0
UgxZpFn5lT1n1pZQVpV4AaABAg,2024-05-30T14:36:59Z,@user-gd5gz6mw7x,"Kehabisan.anggaran.utk memenangkan.anaknnya ,dg membodohi bagi"" bansos. Dkrg muncul penyiksaan.rakyat",Thread,http://www.youtube.com/@user-gd5gz6mw7x,UCacKqBC6zeSLMh4uSyamQGw,2024-05-30T14:36:59Z,,,,1
UgzL0-j6H0p4UiX98aJ4AaABAg,2024-05-30T14:36:26Z,@rusmanperawang4676,Tapera untuk persiapan korupsi pejabat,Thread,http://www.youtube.com/@rusmanperawang4676,UCmP8LiA9X5u3r1pLD_FWAHA,2024-05-30T14:36:26Z,,,,0
UgyeoXGXFBLs4dbyf5F4AaABAg,2024-05-30T14:35:14Z,@aghnymardhiyah1157,Yang pasti TAPERA untuk rakyat. Pekerja itukan RAKYAT...! Jelas GAK?,Thread,http://www.youtube.com/@aghnymardhiyah1157,UC79EySXounfzwBO0VxuENww,2024-05-30T14:35:14Z,,,,0
Ugyv-wPiNGQog4XIsZZ4AaABAg,2024-05-30T14:35:04Z,@orgkampong,Indonesia gak lagi dpt utang olih itu paksa warga....uang kumpul di beresin IKN.,Thread,http://www.youtube.com/@orgkampong,UCKLEccm2q5K8Bc0KKAhYicg,2024-05-30T14:35:04Z,,,,0
UgyLM1AtGHDYZeT8kmV4AaABAg,2024-05-30T14:34:54Z,@kikolamhot316,Oke Gass..  Oke gass.. tinggal jogetin aja..😜😜😜,Thread,http://www.youtube.com/@kikolamhot316,UCd6abNBhOo5kZQQaUG_Af1Q,2024-05-30T14:34:54Z,,,,0
UgwLyooFSbcFXqXPR0h4AaABAg,2024-05-30T14:33:38Z,@mohamadnares5008,Ràkyat yg nabung yg makan para koruptor,Thread,http://www.youtube.com/@mohamadnares5008,UCEhPvLY1srjcq32UAfdyU0w,2024-05-30T14:33:38Z,,,,0
UgyO71c-aSQ5uhdiuxN4AaABAg,2024-05-30T14:33:06Z,@triradiyoko8076,Walo itu membebani rskyat beliau tetep tak bergeming karena hatinya sdh membeku dan membatu,Thread,http://www.youtube.com/@triradiyoko8076,UCnJm5TBUA3dPH6kDh1-w7qA,2024-05-30T14:33:06Z,,,,0
UgwOEA8kVRQEjUJ4X-94AaABAg,2024-05-30T14:31:35Z,@suparlanalan1692,"Lahan baru untuk di korupsi,,,,ingat Taspen,,???",Thread,http://www.youtube.com/@suparlanalan1692,UChHc0YMnbj2GysJL4DsLIkQ,2024-05-30T14:31:35Z,,,,0
Ugw90c3k7ncvc2Kua1Z4AaABAg,2024-05-30T14:30:42Z,@gigiklima,"271 TRILIYUN.
Rumah harga 250JT = 1.084.000 Unit Rumah.
Rumah harga 160Jt  = 1.693.750 Unit Rumah.
Rumah harga 100JT = 2.710.000 Unit Rumah.

UMR 2.500.000 perlu waktu 3,3 Tahun untuk mencapai 100JT (tanpa ada pengeluaran apapun) 😅.....",Thread,http://www.youtube.com/@gigiklima,UCL1W_iDOwgpPCjqS_mKLCEw,2024-05-30T14:30:42Z,,,,10
A43eEHSmq2rA44spRlhfOh,2024-05-31T01:57:29Z,@hairilanwar8544,Negeri Konoha ada2 aja 😂😂😂,Reply,http://www.youtube.com/@hairilanwar8544,UCL1W_iDOwgpPCjqS_mKLCEw,2024-05-31T01:57:29Z,Ugw90c3k7ncvc2Kua1Z4AaABAg,@gigiklima,,1
A43eEHSmq2rA47hQlMlAvR,2024-06-01T04:15:35Z,@gadgetgasspoll2923,Dapat rumah masa depan 2X1 meter,Reply,http://www.youtube.com/@gadgetgasspoll2923,UCL1W_iDOwgpPCjqS_mKLCEw,2024-06-01T04:15:35Z,Ugw90c3k7ncvc2Kua1Z4AaABAg,@gigiklima,,1
A43eEHSmq2rA4834e9iuIf,2024-06-01T07:33:32Z,@iralano3596,Tambahkan 109 TON EMAS,Reply,http://www.youtube.com/@iralano3596,UCL1W_iDOwgpPCjqS_mKLCEw,2024-06-01T07:33:32Z,Ugw90c3k7ncvc2Kua1Z4AaABAg,@gigiklima,,0
UgzuRTDpif8r64XVMMR4AaABAg,2024-05-30T14:30:39Z,@nuhanahar7358,Kalau keberatan ya dijogetin aja.gitu aja kok repot,Thread,http://www.youtube.com/@nuhanahar7358,UCCU5b4YcjOy5K-eAhr4RwHQ,2024-05-30T14:30:39Z,,,,0
Ugwjqdlzx1ui8VD_iFt4AaABAg,2024-05-30T14:25:21Z,@nanangpermana7806,"Kuncinya sita harta  koruptor & miskinkan. Hasilnya digunakan untuk keperluan rakyat jgn ksh kesempatan koruptor berkembang lagi, hukum mati koruptor nya, coba sekarang kita amati yg sdg hangat ini yg besarnya 300T, mari kita amati perkembangannya",Thread,http://www.youtube.com/@nanangpermana7806,UClmI_3p3EX8OPhcUx3nl8fQ,2024-05-30T14:25:21Z,,,,1
Ugws_Zi2qCJYzPG1M2t4AaABAg,2024-05-30T14:23:58Z,@virtuinc7298,"Kalau memang niat pemerintah itu baik, yaitu agar rakyatnya punya rumah, kenapa tidak ditawarkan kredit tanpa bunga ke karyawan yang berminat? Angsuran dipotong dari gaji. Rumah bisa diterima di awal.",Thread,http://www.youtube.com/@virtuinc7298,UCTRJo1ikhN5oiPIGmVUAQpg,2024-05-30T14:23:58Z,,,,14
A43dSwFNLOjA456EKZn1DW,2024-05-31T04:03:21Z,@fathansyah1206,Namanya juga nipu rakyat,Reply,http://www.youtube.com/@fathansyah1206,UCTRJo1ikhN5oiPIGmVUAQpg,2024-05-31T04:03:21Z,Ugws_Zi2qCJYzPG1M2t4AaABAg,@virtuinc7298,,0
UgyvUSKH3cV0BRMXUpl4AaABAg,2024-05-30T14:23:33Z,@kehekkehek3191,Jujur aja negara sudah tidak punya uang kok repot,Thread,http://www.youtube.com/@kehekkehek3191,UCvphHJHfgWYKygZ93_wGYPg,2024-05-30T14:23:33Z,,,,0
Ugy4qvhh6leILTRmWX94AaABAg,2024-05-30T14:21:52Z,@kehekkehek3191,Negara ini sdh semakin TDK tahu malu terhadap warga negaranya.,Thread,http://www.youtube.com/@kehekkehek3191,UCvphHJHfgWYKygZ93_wGYPg,2024-05-30T14:21:52Z,,,,0
Ugyy15qGHI4DCNq6VHZ4AaABAg,2024-05-30T14:21:45Z,@ArisMurrung-bg6kq,Lucu pemerintah kok paksa masyarakat hrus nabung melalui pemerintah dgn nama tapera😂😂😂,Thread,http://www.youtube.com/@ArisMurrung-bg6kq,UCY_sLAtMlA0g1Htbi2BqJDQ,2024-05-30T14:21:45Z,,,,0
Ugw7KG_QVOXDCoGfWfd4AaABAg,2024-05-30T14:20:24Z,@zulamri6353,"Modus broo.. Kumpullan cuan, ujungnya di korup,. Cicilan 1,7Jt selama 30thn, rumah subsidi cicilan cuma1,2jt.",Thread,http://www.youtube.com/@zulamri6353,UCUoqw29qCmnAnPtuCgCaP-A,2024-05-30T14:24:31Z,,,,0
UgyjblwscS1SgeYx-xp4AaABAg,2024-05-30T14:19:59Z,@suratunsuratun188,"Sy guru, pensiun September 2022.  Masa kerja 40 th 3 bl. Golongan 4b. Gaji dipotong setiap bln. Menerima TAPERA 7.543.000. Dgn uang segitu kira"" dpt rumah seperti apa ya.... Jgn ngadi"" ah",Thread,http://www.youtube.com/@suratunsuratun188,UCG1YYMlfczFTtjlWaQGscrw,2024-05-30T14:19:59Z,,,,43
Ugy0a_WjUZmLIZv-0sZ4AaABAg,2024-05-30T14:19:13Z,@arisnugroho4231,"Sy pensiunan pns, ketika pensiun hanya dpt 1 jt",Thread,http://www.youtube.com/@arisnugroho4231,UCzMVE7GnHHT7dJPFDt5hOYg,2024-05-30T14:19:13Z,,,,0
UgyuoS4IykctIv_5SBh4AaABAg,2024-05-30T14:17:32Z,@Pandakecil-c4v,"Selama pemerintah Indonesia tidak menghukum mati pelaku korupsi, percuma!!! Paling dimakan lagi itu duit oleh oknum, Orang Indonesia sudah paham otak oknum, paling di penjara dan di remisi masa tahanan, keluar penjara masih tetap kaya itu oknum",Thread,http://www.youtube.com/@Pandakecil-c4v,UCZ9eK-a_iLsS-kNydoAmbhQ,2024-05-30T14:17:32Z,,,,8
UgzsGodlYuAYGI_9gWR4AaABAg,2024-05-30T14:17:26Z,@arisnugroho4231,"Dananya akhirnya akan dikorupsi oleh pengelola...kayak asabri, taspen, jiwasraya...coba aja nanti dibuktikan.",Thread,http://www.youtube.com/@arisnugroho4231,UCzMVE7GnHHT7dJPFDt5hOYg,2024-05-30T14:17:26Z,,,,0
UgxD8Vs87vRmkJFD5OB4AaABAg,2024-05-30T14:15:03Z,@yossycovalina1802,ANEHHHH....SUSAH DI NALAR...,Thread,http://www.youtube.com/@yossycovalina1802,UCeCbrgLd8dw2nE-qgFkxIHQ,2024-05-30T14:15:03Z,,,,0
Ugxr6900VWOoPzUSTbh4AaABAg,2024-05-30T14:14:29Z,@muharimashari4808,Kebijakan yg sangat bar bar tak punya kepedulian rakyat pemimpin tak punya hati nuraninya,Thread,http://www.youtube.com/@muharimashari4808,UClGkiqbwIp60MYMg7Xjcmpw,2024-05-30T14:14:29Z,,,,0
Ugw4lDQ8t4zLDGRB51F4AaABAg,2024-05-30T14:10:45Z,@bowosungkowo,"Program akal akalan,,,,  yg tak masuk akal😂😂😂",Thread,http://www.youtube.com/@bowosungkowo,UCPF1si6m2bTbFyRmqYUokUw,2024-05-30T14:10:45Z,,,,0
UgxVxQ4Lnl6koDlRhdJ4AaABAg,2024-05-30T14:10:36Z,@brianrachmat3492,"Teman saya pekerja mandiri, walaupun hidup cukup bukan berarti dia hidup berlebih ,kebetulan karena modal usahanya cukup besar dan beragama Muslim dia sudah membayar Zakat sebesar 100 Juta  setiap tahun, jadi kalau istilah gotong royong pemerintah tidak perlu memaksa lagi apalagi hingga 3% setiap bulan.",Thread,http://www.youtube.com/@brianrachmat3492,UCbGBxuTZw20iuyrPVucVm8g,2024-05-30T14:10:36Z,,,,11
A43bw7XU4uGA44v06buOGe,2024-05-31T02:16:33Z,@nurhandayani6690,Gotong royong kan seakan simbol.... liat bpjs... konsepnya sm aja gotong royong.... 😊😊😊,Reply,http://www.youtube.com/@nurhandayani6690,UCbGBxuTZw20iuyrPVucVm8g,2024-05-31T02:16:33Z,UgxVxQ4Lnl6koDlRhdJ4AaABAg,@brianrachmat3492,,1
UgzqCaeKaG2ATqDMhed4AaABAg,2024-05-30T14:09:33Z,@putuadnyana7921,TAPERA Tabungan penipu rakyat 😭😭😭😭😭,Thread,http://www.youtube.com/@putuadnyana7921,UCsleOiUTOFMhxEvMimO09Cg,2024-05-30T14:09:33Z,,,,0
Ugx2nBcH0WYeUS1ZaH54AaABAg,2024-05-30T14:08:29Z,@sinarsotardugapanggabean7716,"# tolak TAPERA, curiga buat cawe""",Thread,http://www.youtube.com/@sinarsotardugapanggabean7716,UCbWOv6uEbTWYFbWj-md-yvQ,2024-05-30T14:08:29Z,,,,0
Ugy6csCwNhOG1qKqTqV4AaABAg,2024-05-30T14:03:51Z,@ngowod786,Tapera omon omon,Thread,http://www.youtube.com/@ngowod786,UCPJbv5gIUBngpxL26695-UA,2024-05-30T14:03:51Z,,,,0
UgxP085nK1bmX8ALarV4AaABAg,2024-05-30T14:02:57Z,@deborapurnomo4227,Betul sekali pak setuju..batalkan saja....urusan negeri banyak.yg nggak kelar..koq.msh buat kebijak2an..baru,Thread,http://www.youtube.com/@deborapurnomo4227,UC-rAm2TSPtoPREshoGnTMzg,2024-05-30T14:02:57Z,,,,0
Ugz2mIC7aUfyhPHNTtN4AaABAg,2024-05-30T13:56:45Z,@ahmadsanwani2966,LADANG KORUPSI TERBARU PEMBUAT KEBIJAKAN,Thread,http://www.youtube.com/@ahmadsanwani2966,UC7Q676ngFtxUCi8d_pjTkrg,2024-05-30T13:56:45Z,,,,0
UgxI--HMQ2YKP2vgv9N4AaABAg,2024-05-30T13:56:44Z,@ngowod786,BUruh kontrak gmn nasibnya kalo sudah hbs kontrak apakah bisa di kembalikan uangnya,Thread,http://www.youtube.com/@ngowod786,UCPJbv5gIUBngpxL26695-UA,2024-05-30T13:56:44Z,,,,0
Ugyx6zc3dolrMIm5Qjh4AaABAg,2024-05-30T13:55:49Z,@walkingkhuan,Berlakukan dl hukuman mati bagi koruptor br kita bicara tapera..,Thread,http://www.youtube.com/@walkingkhuan,UCFdQ0ceSm8Uyo9-x5w3RL-g,2024-05-30T13:55:49Z,,,,0
UgxNY-87zZDAUTsDb9p4AaABAg,2024-05-30T13:51:24Z,@muhammadrudi7189,"indonesia negara yg kaya,, kaya sumberdaya alam, dll....semuaclengkap......,tp pendapatan negara cuma dr pajak dan gotong royong potongan upah dr rakyatnya......... betapa bobroknya kualitas pemimpin di negri ini",Thread,http://www.youtube.com/@muhammadrudi7189,UCW2x_oXLB8itFO1fBo7vEAQ,2024-05-30T13:51:24Z,,,,0
UgxBztkksfbyqwiw9a14AaABAg,2024-05-30T13:49:54Z,@ngowod786,Saya setuju kalo korupsi di hukum mati.,Thread,http://www.youtube.com/@ngowod786,UCPJbv5gIUBngpxL26695-UA,2024-05-30T13:49:54Z,,,,0
UgzYGzBQjKk6sfMwasJ4AaABAg,2024-05-30T13:49:43Z,@hildahoro7082,"Ko sudah mau lengser macam"" saja otaknya..duduk diam ko tinggal tunggu 4 bulan lagi..macam"" saja..bukan pengusaha saja kami pensi pns tidak setuju..",Thread,http://www.youtube.com/@hildahoro7082,UCWYPJJ_1MJ0B_KS-2b8TRkQ,2024-05-30T13:49:43Z,,,,0
Ugw0JcmBGs3pLJa80MN4AaABAg,2024-05-30T13:48:59Z,@ngowod786,Hdhhhh mumet ga paham maksudnya,Thread,http://www.youtube.com/@ngowod786,UCPJbv5gIUBngpxL26695-UA,2024-05-30T13:48:59Z,,,,0
UgzsnyiDjZmkr42VYbZ4AaABAg,2024-05-30T13:46:53Z,@muisMSi,Otak dagang untuk memperkaya orang tertentu,Thread,http://www.youtube.com/@muisMSi,UCcDiBCsagTJDDpddcn3w48w,2024-05-30T13:46:53Z,,,,0
UgzU63hBPjZ38Ix-get4AaABAg,2024-05-30T13:43:09Z,@NanangWahyu-qi6nr,"Gila ya di tempak saya buruh pabrik aja sehari 72500, bahkan ada yang 40-50 ribu sehari , mau makan apa rakyatmu ini raja iblis  😂",Thread,http://www.youtube.com/@NanangWahyu-qi6nr,UC7nXAhHT1z4HYRqgJwHmojw,2024-05-30T13:43:46Z,,,,0
UgyoxzItDTDOPVk_ti94AaABAg,2024-05-30T13:41:33Z,@shafa2004,Kebijakan yang minim sosialisasi menunjukkan adanya maksud yang tersembunyi dari pemerintah terkait dengan dana yang terkumpul dari Tapera,Thread,http://www.youtube.com/@shafa2004,UCDvxNfykbtnwXZGcVuIsjzA,2024-05-30T13:41:33Z,,,,2
UgwRxc7wmCyQpuA-1454AaABAg,2024-05-30T13:41:21Z,@RisandiRisandi,"selamat menikmati, itu yg kalian mau, lanjutkan, jadi dijogetin aja tidak perlu protes",Thread,http://www.youtube.com/@RisandiRisandi,UC3xlv4y2zOw0pR8drBMj3Mg,2024-05-30T13:41:21Z,,,,9
Ugwkq6Tewmx0NqRcPGB4AaABAg,2024-05-30T13:41:10Z,@yogisuprayogi7143,AYO DEMO BESOK.. jangan jadi pengecut... jangan cuma gerutu doang. . Pemerintah udah gak waras,Thread,http://www.youtube.com/@yogisuprayogi7143,UC6FyykHDTd2bvo-kDHZ05AA,2024-05-30T13:41:10Z,,,,0
UgyHf5t3FEwdvVBbBo94AaABAg,2024-05-30T13:37:59Z,@user-lr2wk7pe2d,pns setiap bln gaji dipotong utk tapera setelsh pensiun sampai skg blm ada dikembalikan...( ribet pengurusan nya banya ttb nya),Thread,http://www.youtube.com/@user-lr2wk7pe2d,UC7MkAEHszwaUnk2C7we829Q,2024-05-30T13:37:59Z,,,,0
UgwNgzZ0VY4-HfeSuUZ4AaABAg,2024-05-30T13:35:54Z,@deborapurnomo4227,"Yg pertama usul tapera sopo seh.

Koq pintarnya kelewatan..",Thread,http://www.youtube.com/@deborapurnomo4227,UC-rAm2TSPtoPREshoGnTMzg,2024-05-30T13:35:54Z,,,,0
UgzzJc69hVDQxKiVM194AaABAg,2024-05-30T13:32:42Z,@ekoyulianto5253,"Matematika-nya gimana nih pemerintah terkait usulan ini .. ? Apalagi masing2 daerah umr / umknya berbeda .. yg karyawan daerah saja masih ada yg  gaji 2,4 jt dipotong 2,5% brp dan sampai kapan tuh ... ? Karyawan swasta lebih terasa tuh khususnya golongan karyawan kebawah & menengah , apalagi ada phk",Thread,http://www.youtube.com/@ekoyulianto5253,UCprdcPHUzxXv6hpRawS3inw,2024-05-30T13:32:42Z,,,,0
Ugw7j1Evq_C1KgKV3S94AaABAg,2024-05-30T13:31:15Z,@avitiswanto9880,NAJISSSSSSSSSS,Thread,http://www.youtube.com/@avitiswanto9880,UC8kAqz0ldUStxkByNUFpHNw,2024-05-30T13:31:15Z,,,,0
UgxsqpUFk8Lu_jJ3H-p4AaABAg,2024-05-30T13:29:53Z,@RisandiRisandi,"akal2an korupsi uang rakyat, berdalih di investasikan ujung2nya zonk, yg kayak siapa, sama halnya BPJS,",Thread,http://www.youtube.com/@RisandiRisandi,UC3xlv4y2zOw0pR8drBMj3Mg,2024-05-30T13:29:53Z,,,,0
Ugx9HiCSYRjpsPo2uf14AaABAg,2024-05-30T13:29:00Z,@hadipurnomo3710,Kini namanya apa berganti ya. . . Dulu bapetarum. . .dan sekarang Tapera??? Yg bapetarum aj ruwet. . . .trus. . . .ini mau kemana lagi,Thread,http://www.youtube.com/@hadipurnomo3710,UCWGMJbFY2K5_8Jpo1jXyEeA,2024-05-30T13:29:00Z,,,,0
UgzDQQJIHTL5zq76S7p4AaABAg,2024-05-30T13:27:52Z,@ekoyulianto5253,"Lha tapi nggak nyambung pak nnti jika si karyawan pensiun , itu rumah belum juga lunas dong , jatuhnya sdh gak kerja masih kena beban utang rumah .. pye pak nggak nyambung itu . Mana ada rmh hrga 18 jt .. ?",Thread,http://www.youtube.com/@ekoyulianto5253,UCprdcPHUzxXv6hpRawS3inw,2024-05-30T13:27:52Z,,,,0
UgybXyMW2mI6G7vvmg54AaABAg,2024-05-30T13:26:17Z,@user-jk3mq6dd8u,RACUN NKRI YAITU SI JOKO,Thread,http://www.youtube.com/@user-jk3mq6dd8u,UC1VatBu8s8T6ExSAfaDKcmA,2024-05-30T13:26:17Z,,,,0
UgzBkF59P_ii4lU3jx54AaABAg,2024-05-30T13:25:41Z,@harsonokdj3511,Nipu pemeras,Thread,http://www.youtube.com/@harsonokdj3511,UCH0w2Mru3ZtOau6Y9bV_T2A,2024-05-30T13:25:41Z,,,,0
UgygL0sIppjcX2M2BMh4AaABAg,2024-05-30T13:24:58Z,@beninggerai841,Mau ada program apapun gk masalah... Yang peunting rakyat di kasih 10juta perbulan tanpa harus kerja... Ada program baru naikin juga dr 10juta jadi 20juta....gk bklan ada yg prote yakin saya,Thread,http://www.youtube.com/@beninggerai841,UCe7lJN1AcKjNTBe9B2NYp9Q,2024-05-30T13:24:58Z,,,,0
UgwFg4bvHz4EFcnGjpB4AaABAg,2024-05-30T13:23:39Z,@user-lr2wk7pe2d,Pensiunan sj blm kembalikan uang tapera nya sampai skg padahal sdh lama pensiun,Thread,http://www.youtube.com/@user-lr2wk7pe2d,UC7MkAEHszwaUnk2C7we829Q,2024-05-30T13:23:39Z,,,,0
Ugzb_O3RBMMyg0imlKN4AaABAg,2024-05-30T13:20:08Z,@herlinanina1478,Mungkin agenda makan gratis kurang dana jadi ngakalin masyarakat,Thread,http://www.youtube.com/@herlinanina1478,UCeFd3VE2zzZMRnZ5W-n2GfQ,2024-05-30T13:20:08Z,,,,0
Ugx9BAKe34M-FDY0jPt4AaABAg,2024-05-30T13:16:48Z,@deborapurnomo4227,Pegawai swasta...mau naik gaji susah pak..,Thread,http://www.youtube.com/@deborapurnomo4227,UC-rAm2TSPtoPREshoGnTMzg,2024-05-30T13:16:48Z,,,,0
UgzhmNPfq26JV2DKLaF4AaABAg,2024-05-30T13:16:27Z,@jihan7,Asyik nggak asyik,Thread,http://www.youtube.com/@jihan7,UCpyJvlP8eVirLRIls18OryA,2024-05-30T13:16:27Z,,,,0
UgyiH_8XydF-Gocqszh4AaABAg,2024-05-30T13:16:22Z,@mymelody9698,dimana lokasi rumah hasil bapetarum yg katanya 14.000 itu?? coba sebut lokasi.... mau liat,Thread,http://www.youtube.com/@mymelody9698,UCW89xWrx1MjYauEyILcBRcw,2024-05-30T13:16:22Z,,,,0
Ugys-Z2u39_e_XvCPeV4AaABAg,2024-05-30T13:13:38Z,@mymelody9698,halahhhh pernah nyoba investasi disekuritas dana dimanage manajer investasi aja gak ada untungnya kok. Tergeruusss teruuus... ini jaman sebelum covid lho ya. Yg akhirnya relain ajalah.... lagian percaya drmn tapera bisa milih manajer investasi handal. Gak percaya!!!!,Thread,http://www.youtube.com/@mymelody9698,UCW89xWrx1MjYauEyILcBRcw,2024-05-30T13:13:38Z,,,,0
Ugwv91T9T_fxHO9oW5F4AaABAg,2024-05-30T13:11:27Z,@beninggerai841,Rumah nya dmna dbngun nya?,Thread,http://www.youtube.com/@beninggerai841,UCe7lJN1AcKjNTBe9B2NYp9Q,2024-05-30T13:11:27Z,,,,0
